user_input,retrieved_contexts,response,reference,faithfulness,answer_relevancy,llm_context_precision_with_reference,context_recall,synthesizer
"Кто именно утвердил это Положение о членстве, в котором говорится про Исполнительного комитета ОСОО «ФПСР»?","['2. Настоящее Положение принято в соответствии с норм ами действующего \nзаконодательства, включая Федеральный закон от 12.01.1996 № 7 -ФЗ «О  \nнекоммерческих организациях», Федеральный закон от 19.05.1995 № 82 -ФЗ «Об \nобщественных объединениях», Федеральный закон от 13.12.1996 № 150 -ФЗ «Об \nоружии», Федеральный закон от 04.12.2007 № 329-ФЗ «О физической культуре и спорте \nв Российской Федерации», иными нормативно -правовыми актами  Российской \nФедерации и Уставом Федерации. \nВ случае последующего изменения норм законодательства Российской Федерации \nнастоящее Положение действует в части, не противоречащей данным нормам. \n3. Правила настоящего Положения обязательны для всех членов Федерации. \n \nII. ЧЛЕНСТВО В ФЕДЕРАЦИИ \n \n4. Членство в Федерации является добровольным. \n5. Членство в Федерации неотчуждаемо. Осуществление прав члена Федерации не может \nбыть передано другому лицу. \n6.', '[Page 1]\n1 \n \nОБЩЕРОССИЙСКАЯ СПОРТИВНАЯ ОБЩЕСТВЕННАЯ ОРГАНИЗАЦИЯ \nПО РАЗВИТИЮ СТРЕЛКОВЫХ ВИДОВ СПОРТА \n«ФЕДЕРАЦИЯ ПРАКТИЧЕСКОЙ СТРЕЛЬБЫ РОССИИ» \n \nУтверждено решением \nИсполнительного комитета \nОСОО «ФПСР» \nот 22.08.2023 \n \n \n \nПОЛОЖЕНИЕ О ЧЛЕНСТВЕ В ОСОО «ФПСР» \n \n \nI. ОБЩИЕ ПОЛОЖЕНИЯ \n \n1. Настоящее Положение о членстве (далее – Положение) определяет условия и порядок \nприема в члены, исключения (выхода) из членов, порядок уплаты членских и иных \nвзносов, а также права, обязанности и ответственность членов Общероссийской \nспортивной общественной организации по развитию стрелковых видов спорта \n«Федерация практической стрельбы России» (далее – Федерация, ФПСР). \n2.', '7.4 Федерального \nзакона от 07.08.2001 № 115 -ФЗ «О противодействии легализации (отмыванию) \nденежных средств, полученных преступным путем, и финансированию терроризма», \nдо отмены такого решения;  \n\uf02d лицо, включенное в составляемые в рамках реализации полномочий, \nпредусмотренных главой VII Устава ООН, Советом Безопасности ООН или \nорганами, специально созданными решениями Совета Безопасности ООН, перечни \nорганизаций и физическ их лиц, связанных с террористическими организациями и \nтеррористами или с распространением оружия массового уничтожения. \n9. Членам Федерации - физическим лицам за особые заслуги в развитии вида спорта \n«практическая стрельба» и (или) выдающиеся спортивные дости жения по виду спорта \n«практическая стрельба» на основании решения Президента Федерации может быть \nприсвоено звание «Почетный член ОСОО « ФПСР». Член Федерации со званием \n«Почетный член ОСОО «ФПСР» освобождается от уплаты членских взносов. \n10. Учет членов Федерации организует Президент Федерации. \n \nIII.', 'п. 8 настоящего Положения); \n\uf02d невыполнение или ненадлежащее выполнение обязанностей члена ОСОО «ФПСР», \nпредусмотренных Уставом Федерации и Положением; \n\n[Page 9]\n9 \n \n\uf02d вступление в законную силу судебного акта, в соответствии с которым лицу \nзапрещена деятельность, связанная с оружием; \n\uf02d наличие двух и более спортивных дисквалификаций для спортсменов и спортивных \nсудей; \n\uf02d нарушение Устава, регламентов, п оложений или решений, принятых \nкомпетентными органами ФПСР. \n45. Поводом для вынесения Исполнительным комитетом решения об исключении из \nчленов Федерации могут являться: \n\uf02d представление Председателя регионального отделения /Руководителя \nаккредитованного РСОО; \n\uf02d заключение Дисциплинарного комитета Федерации; \n\uf02d представление Исполнительного комитета Федерации; \n\uf02d представление Президента Федерации; \n\uf02d представление Совета Корпуса спортивных судей; \n\uf02d представление Тренерского совета; \n\uf02d представление Совета Корпуса предмобилизационной подготовки. \n46.', '37. На основании решения Президента Федерации о принятии в члены Федерации \nвыдается: \n\n[Page 8]\n8 \n \n\uf02d физическому лицу – электронное удостоверение установленного образца \n(приложение № 1 к настоящему Положению), которому присваивается персональный \nидентификационный номер . Возможно  также изготовление пластикового \nудостоверения за дополнительную плату  (приложение №  2 к настоящему \nПоложению); \n\uf02d юридическому лицу – решение Президента Федерации, заверенное печатью \nФедерации и подписью Президента Федерации, с присвоением персонального \nидентификационного членского номера. \n38. Персональный идентификационный номер электронного удостоверения указывается в \nличном кабинете члена Федерации  - физического лица . В случае неоплаты членских \nвзносов в личный кабинет члена Федерации н аправляется уведомление с указанием \nсрока оплаты задолженности. В период существования задолженности в озможность \nвнесения изменений в профиль личного кабинета и совершение иных действий с \nаккаунтом заблокирована. \n39.']",Исполнительный комитет ОСОО «ФПСР» утвердил данное Положение о членстве.,Положение о членстве было утверждено решением Исполнительного комитета ОСОО «ФПСР» от 22.08.2023.,,,,,single_hop_specifc_query_synthesizer
Соответствует ли настоящее Положение требованиям Федерального закона от 19.05.1995 № 82-ФЗ «Об общественных объединениях»?,"['2. Настоящее Положение принято в соответствии с норм ами действующего \nзаконодательства, включая Федеральный закон от 12.01.1996 № 7 -ФЗ «О  \nнекоммерческих организациях», Федеральный закон от 19.05.1995 № 82 -ФЗ «Об \nобщественных объединениях», Федеральный закон от 13.12.1996 № 150 -ФЗ «Об \nоружии», Федеральный закон от 04.12.2007 № 329-ФЗ «О физической культуре и спорте \nв Российской Федерации», иными нормативно -правовыми актами  Российской \nФедерации и Уставом Федерации. \nВ случае последующего изменения норм законодательства Российской Федерации \nнастоящее Положение действует в части, не противоречащей данным нормам. \n3. Правила настоящего Положения обязательны для всех членов Федерации. \n \nII. ЧЛЕНСТВО В ФЕДЕРАЦИИ \n \n4. Членство в Федерации является добровольным. \n5. Членство в Федерации неотчуждаемо. Осуществление прав члена Федерации не может \nбыть передано другому лицу. \n6.', '10 Федерального закона от 25.06.2002 № 114 -ФЗ «О противодействии \nэкстремистской деятельности»; \n\uf02d лицо, включенное в перечень в соответствии с п. 2 ст. 6 Федерального закона от \n07.08.2001 № 115 -ФЗ «О противодействии легализаци и (отмыванию) ден ежных \nсредств, полученных преступным путем, и финансированию терроризма»;  \n\uf02d организация или физическое лицо, в отношении которых межведомственным \nкоординационным органом, осуществляющим функции по противодействию \nфинансированию терроризма, принято решение о  замораживании (блокировании) \nденежных средств или иного имущества в соответствии со ст .', 'членские и целевые взносы в порядке и \nразмере, установленном решением Конференции и настоящим Положением; \n\uf02d Выполнять решения руководящих органов Федерации; \n\uf02d Соблюдать Устав Федерации и иные регулирующие деятельность Федерации акты; \n\uf02d Воздерживаться от деятельности, противоречащей целям и задачам Федерации; \n\uf02d Не совершать действий (бездействий), нарушающих Устав Федерации, этику  \nспортивных и товарищеских взаимоотношений, подрывающих авторитет ФПСР, а \nтакже действий, наносящих репутационный и материальный ущерб Федерации; \n\uf02d Не совершать действий (бездействий), которые существенно затрудняют или делают \nневозможным достижение целей, ради которых создана Федерация; \n\uf02d Не разглашать конфиденциальную информацию о деятельности Федерации; \n\uf02d Вносить необходимые изменения в учетную запись личного кабинета члена \nФедерации в случае смены персональных и иных контактных данных; \n\uf02d Не распространять сведения, порочащие деловую репутацию Федерации, а также \nчесть, достоинство членов, работников и лиц,', 'порочащие деловую репутацию Федерации, а также \nчесть, достоинство членов, работников и лиц, входящих в ее органы управления в \nсредствах массовой информации. (данный абзац переписан в другой стилистической \nформулировке не изменяющей сути вопроса) \n19. Члены Федерации - юридические лица обязаны: \n\uf02d Своевременно уплачивать вступительные, членские и целевые взносы в порядке и \nразмере, установленным решением Конференции и настоящим Положением; \n\uf02d Выполнять решения руководящих органов Федерации; \n\uf02d Соблюдать Устав Федерации и иные регулирующие деятельность Федерации акты; \n\uf02d Воздерживаться от деятельности, противоречащей целям и задачам Федерации; \n\uf02d Не совершать действий (бездействий), нарушающих Устав Федерации, этику \nспортивных и товарищеских взаимоотно шений, а также действий, наносящих \nрепутационный и материальный ущерб Федерации; \n\uf02d Не совершать действий (бездействий), которые существенно затрудняют или делают \nневозможным достижение целей, ради которых создана Федерация;', 'Юридические лица  могут стать членами Федерации при условии, что они выражают \nсолидарность с уставными целями и задачами Федерации, и их уставы не противоречат \nУставу Федерации. \n7. Физические и юридические лица, принятые в члены Федерации до вступления в силу \nнастоящего Положения, сохраняют свое членство без прохождения процедуры \nвступления в члены Федерации, установленной настоящим Положением. \n8. Не могут быть членами Федерации л ица, круг которых определен действующим \nзаконодательством Российской Федерации или актами самой Федерации, включая, в \nтом числе: \n\uf02d лицо, содержащееся в местах лишения свободы по приговору суда;  \n\uf02d лицо, в отношении которого вступившим в законную силу решением  суда \nустановлено, что в его действиях содержатся признаки экстремистской деятельности;  \n\uf02d лицо, признанн ое судом недееспособным  в порядке, установленном гражданским \nпроцессуальным законодательством; \n\uf02d общественное объединение, деятельность которого приостановлена в соот ветствии \nсо ст .']","Да, настоящее Положение принято в соответствии с нормами Федерального закона от 19.05.1995 № 82‑ФЗ «Об общественных объединениях», поэтому оно соответствует его требованиям.","Согласно пункту 2, настоящее Положение принято в соответствии с нормами действующего законодательства, включая Федеральный закон от 19.05.1995 № 82-ФЗ «Об общественных объединениях».",,1.0000000000000002,0.9999999999,1.0,single_hop_specifc_query_synthesizer
"кто там может быть член Федерации по этому тексту, скажите по пунктам","['Юридические лица  могут стать членами Федерации при условии, что они выражают \nсолидарность с уставными целями и задачами Федерации, и их уставы не противоречат \nУставу Федерации. \n7. Физические и юридические лица, принятые в члены Федерации до вступления в силу \nнастоящего Положения, сохраняют свое членство без прохождения процедуры \nвступления в члены Федерации, установленной настоящим Положением. \n8. Не могут быть членами Федерации л ица, круг которых определен действующим \nзаконодательством Российской Федерации или актами самой Федерации, включая, в \nтом числе: \n\uf02d лицо, содержащееся в местах лишения свободы по приговору суда;  \n\uf02d лицо, в отношении которого вступившим в законную силу решением  суда \nустановлено, что в его действиях содержатся признаки экстремистской деятельности;  \n\uf02d лицо, признанн ое судом недееспособным  в порядке, установленном гражданским \nпроцессуальным законодательством; \n\uf02d общественное объединение, деятельность которого приостановлена в соот ветствии \nсо ст .', 'Членство в Федерации неотчуждаемо. Осуществление прав члена Федерации не может \nбыть передано другому лицу. \n6. Членами Федерации могут быть признающие и разделяющие цели и задачи Федерации, \nсодействующие деятельности Федерации, своевременно уплачивающие вступительный \nи членские взносы, признающие и соблюдающие Устав, р егламенты, положения и \nрешения Федерации: \n6.1. физические лица – граждане Российской Федерации, достигшие возраста 18 лет; \n6.2. юридические лица: \n\uf02d общественные объединения (региональные спортивные федерации практической \nстрельбы и иные общественные объединения, осуществляющие свою деятельность \nпреимущественно в виде спорта «практическая стрельба»); \n\n[Page 2]\n2 \n \n\uf02d спортивные клубы, независимо от их организационно -правовых форм, а также \nобъединения организаций, осуществляющи е свою деятельность в области спорта и \nразвивающие вид спорта «практическая стрельба».', 'которые существенно затрудняют или делают \nневозможным достижение целей, ради которых создана Федерация; \n\uf02d Не разглашать конфиденциальную информацию о деятельности Федерации; \n\uf02d Сообщать об изменениях учредительных документов, реквизитов и иных контактных \nданных; \n\uf02d Не распространять сведения, порочащие честь, достоинство и (или) деловую \nрепутацию Федерации, а также работников и лиц, входящих в ее органы управления в \n\n[Page 5]\n5 \n \nсредствах массовой информации. \n \nV. ПОРЯДОК ВСТУПЛЕНИЯ В ЧЛЕНЫ ФЕДЕРАЦИИ \n \n20. Физические лица, желающие вступи ть в члены Федерации (далее – кандидат в члены \nФедерации), проходят электронную процедуру подачи заявки на вступление в члены \nФедерации. \n21. Для вступления в члены Федерации кандидату в члены Федерации необходимо: \n21.1. Пройти (успешно завершить) курсы безопасного и  квалифицированного \nобращения с оружием (далее – БЕКОСО) у инструктора ФПСР (список \nинструкторов ФПСР опубликован на сайте Федерации в сети Интернет по ссылке \nhttps://ipsc.ru/).', '10. Учет членов Федерации организует Президент Федерации. \n \nIII. ПРАВА ЧЛЕНОВ ФЕДЕРАЦИИ \n \n11. Все члены Федерации пользуются равными правами в соответствии с Уставом , \nПоложением и иными нормативными актами Федерации. \n\n[Page 3]\n3 \n \n12. Права члена Федерации возникают с момента принятия решения Президе нта о \nвступлении его в Федерацию. Прекращение членства ведёт к прекращению всех прав по \nотношению к ФПСР в соответствии с действующим законодательством Российской \nФедерации. \n13. Члены Федерации - физические лица имеют право: \n\uf02d участвовать в управлении делами Федерации, избирать и быть избранными в \nруководящие и контрольно -ревизионные органы Федерации в соответствии с \nУставом Федерации и иными нормативными актами Федерации; \n\uf02d получать информацию о деятельности Федерации и знакомиться с ее бухгалтерской \nи иной документацией по письменному запросу, направляемому Президенту \nФедерации; \n\uf02d вносить предложения, касающиеся деятельности Федерации, участвовать в их \nобсуждении и реализации;', '31. Юридические лица, желающие вступить в члены Федерации, подают письменное \nзаявление на имя Президента Федерации о приеме в члены ФПСР , в котором должно \nбыть указано: полное наименование юридического лица, адрес юридического лица , \nкоды ОКВЭД, согласие с Уставом Федерации и обязательство соблюдать данный Устав \nи другие нормативные акты Федерации. \n32.']","По предоставленному документу членами Федерации могут быть:

1. **Физические лица** – граждане Российской Федерации, достигшие возраста 18 лет, которые признают и разделяют цели и задачи Федерации, содействуют её деятельности, своевременно уплачивают вступительный и членские взносы, признают и соблюдают Устав, регламенты, положения и решения Федерации.

2. **Юридические лица** – общественные объединения (региональные спортивные федерации практической стрельбы и иные общественные объединения, осуществляющие свою деятельность преимущественно в виде спорта «практическая стрельба»).

3. **Юридические лица** – спортивные клубы, независимо от их организационно‑правовых форм, а также объединения организаций, осуществляющие свою деятельность в области спорта и развивающие вид спорта «практическая стрельба».

4. Юридические лица, желающие вступить в члены Федерации, должны подать письменное заявление на имя Президента Федерации, указав полное наименование, адрес, коды ОКВЭД, согласие с Уставом Федерации и обязательство соблюдать его и другие нормативные акты Федерации.

5. Юридические лица могут стать членами только при условии, что они выражают солидарность с уставными целями и задачами Федерации и их уставы не противоречат Уставу Федерации.

6. Физические и юридические лица, принятые в члены Федерации до вступления в силу настоящего Положения, сохраняют своё членство без прохождения процедуры вступления, установленной данным Положением.","Членами Федерации могут быть признающие и разделяющие цели и задачи Федерации, содействующие деятельности Федерации, своевременно уплачивающие вступительный и членские взносы, признающие и соблюдающие Устав, регламенты, положения и решения Федерации: 6.1. физические лица – граждане Российской Федерации, достигшие возраста 18 лет; 6.2. юридические лица: общественные объединения (региональные спортивные федерации практической стрельбы и иные общественные объединения, осуществляющие свою деятельность преимущественно в виде спорта «практическая стрельба»), спортивные клубы, независимо от их организационно-правовых форм, а также объединения организаций, осуществляющие свою деятельность в области спорта и развивающие вид спорта «практическая стрельба».",1.0,0.7692132813046113,0.49999999995,1.0,single_hop_specifc_query_synthesizer
"Какиие условия должны быть соблюдены для того, чтобы юридческие лица могли стать членами Федреции, и какие лица не могут быть членами Федреции согласно Положению?","['Юридические лица  могут стать членами Федерации при условии, что они выражают \nсолидарность с уставными целями и задачами Федерации, и их уставы не противоречат \nУставу Федерации. \n7. Физические и юридические лица, принятые в члены Федерации до вступления в силу \nнастоящего Положения, сохраняют свое членство без прохождения процедуры \nвступления в члены Федерации, установленной настоящим Положением. \n8. Не могут быть членами Федерации л ица, круг которых определен действующим \nзаконодательством Российской Федерации или актами самой Федерации, включая, в \nтом числе: \n\uf02d лицо, содержащееся в местах лишения свободы по приговору суда;  \n\uf02d лицо, в отношении которого вступившим в законную силу решением  суда \nустановлено, что в его действиях содержатся признаки экстремистской деятельности;  \n\uf02d лицо, признанн ое судом недееспособным  в порядке, установленном гражданским \nпроцессуальным законодательством; \n\uf02d общественное объединение, деятельность которого приостановлена в соот ветствии \nсо ст .', 'которые существенно затрудняют или делают \nневозможным достижение целей, ради которых создана Федерация; \n\uf02d Не разглашать конфиденциальную информацию о деятельности Федерации; \n\uf02d Сообщать об изменениях учредительных документов, реквизитов и иных контактных \nданных; \n\uf02d Не распространять сведения, порочащие честь, достоинство и (или) деловую \nрепутацию Федерации, а также работников и лиц, входящих в ее органы управления в \n\n[Page 5]\n5 \n \nсредствах массовой информации. \n \nV. ПОРЯДОК ВСТУПЛЕНИЯ В ЧЛЕНЫ ФЕДЕРАЦИИ \n \n20. Физические лица, желающие вступи ть в члены Федерации (далее – кандидат в члены \nФедерации), проходят электронную процедуру подачи заявки на вступление в члены \nФедерации. \n21. Для вступления в члены Федерации кандидату в члены Федерации необходимо: \n21.1. Пройти (успешно завершить) курсы безопасного и  квалифицированного \nобращения с оружием (далее – БЕКОСО) у инструктора ФПСР (список \nинструкторов ФПСР опубликован на сайте Федерации в сети Интернет по ссылке \nhttps://ipsc.ru/).', 'Членство в Федерации неотчуждаемо. Осуществление прав члена Федерации не может \nбыть передано другому лицу. \n6. Членами Федерации могут быть признающие и разделяющие цели и задачи Федерации, \nсодействующие деятельности Федерации, своевременно уплачивающие вступительный \nи членские взносы, признающие и соблюдающие Устав, р егламенты, положения и \nрешения Федерации: \n6.1. физические лица – граждане Российской Федерации, достигшие возраста 18 лет; \n6.2. юридические лица: \n\uf02d общественные объединения (региональные спортивные федерации практической \nстрельбы и иные общественные объединения, осуществляющие свою деятельность \nпреимущественно в виде спорта «практическая стрельба»); \n\n[Page 2]\n2 \n \n\uf02d спортивные клубы, независимо от их организационно -правовых форм, а также \nобъединения организаций, осуществляющи е свою деятельность в области спорта и \nразвивающие вид спорта «практическая стрельба».', '31. Юридические лица, желающие вступить в члены Федерации, подают письменное \nзаявление на имя Президента Федерации о приеме в члены ФПСР , в котором должно \nбыть указано: полное наименование юридического лица, адрес юридического лица , \nкоды ОКВЭД, согласие с Уставом Федерации и обязательство соблюдать данный Устав \nи другие нормативные акты Федерации. \n32.', '32. Вместе с письменным заявлением юридические  лица предоставляют следующие \nдокументы: \n\uf02d Протокол о решении вступить в Федерацию уполномоченного органа юридического \nлица, к компетенции которого уставом этого юридического лица отнесено принятие \nданного решения; \n\uf02d Нотариально заверенная копия действующего устава юридического лица и \nизменений к нему; \n\uf02d Нотариально заверенная копия с видетельства о государственной регистрации  \nюридического лица; \n\uf02d Нотариально заверенная копия с видетельства о постановке на учет в налоговом \nоргане юридического лица; \n\uf02d Нотариально завер енная копия выписки из единого государственного реестра \nюридический лиц; \n\uf02d Платежное поручение об оплате вступительного и членского взносов  (членский \nвзнос необходимо оплатить на срок не менее чем за один год  по реквизитам, \nуказанным на сайте Федерации в разделе «Реквизиты» , и в размере, указанном в \nГлаве 7 настоящего Положения). \n33. Вышеуказанные документы юридическое лицо направляет непосредственно в  \nФедерацию на имя Президента Федерации. \n34.']","**Условия для вступления юридических лиц в члены Федерации**  
- Выражать солидарность с уставными целями и задачами Федерации.  
- Их устав не должен противоречить Уставу Федерации.  
- Признавать и разделять цели и задачи Федерации, содействовать её деятельности.  
- Своевременно уплачивать вступительный и членский взносы.  
- Признавать и соблюдать Устав, регламенты, положения и решения Федерации.  
- Подать письменное заявление на имя Президента Федерации с указанием: полного наименования, адреса, кодов ОКВЭД, согласия с Уставом и обязательства его соблюдать.  
- Вместе с заявлением предоставить:  
  • протокол решения уполномоченного органа о вступлении в Федерацию;  
  • нотариально заверенную копию действующего устава и изменений к нему;  
  • нотариально заверенную копию свидетельства о государственной регистрации;  
  • нотариально заверенную копию свидетельства о постановке на учет в налоговом органе;  
  • нотариально заверенную копию выписки из ЕГРЮЛ;  
  • платёжное поручение об оплате вступительного и членского взносов (вз","Юридические лица могут стать членами Федерации при условии, что они выражают солидарность с уставными целями и задачами Федерации, и их уставы не противоречат Уставу Федерации. Не могут быть членами Федерации лица, круг которых определен действующим законодательством Российской Федерации или актами самой Федерации, включая, в том числе: лицо, содержащееся в местах лишения свободы по приговору суда; лицо, в отношении которого вступившим в законную силу решением суда установлено, что в его действиях содержатся признаки экстремистской деятельности; лицо, признанное судом недееспособным в порядке, установленном гражданским процессуальным законодательством; общественное объединение, деятельность которого приостановлена в соответствии со ст.",1.0,0.7450385490515621,0.9999999999,1.0,single_hop_specifc_query_synthesizer
слыш ты там по этому Федерального закона от 25.06.2002 № 114 -ФЗ че там написано в тексте про противодействие чему там экстремистской деятельности или как оно там,"['10 Федерального закона от 25.06.2002 № 114 -ФЗ «О противодействии \nэкстремистской деятельности»; \n\uf02d лицо, включенное в перечень в соответствии с п. 2 ст. 6 Федерального закона от \n07.08.2001 № 115 -ФЗ «О противодействии легализаци и (отмыванию) ден ежных \nсредств, полученных преступным путем, и финансированию терроризма»;  \n\uf02d организация или физическое лицо, в отношении которых межведомственным \nкоординационным органом, осуществляющим функции по противодействию \nфинансированию терроризма, принято решение о  замораживании (блокировании) \nденежных средств или иного имущества в соответствии со ст .', '7.4 Федерального \nзакона от 07.08.2001 № 115 -ФЗ «О противодействии легализации (отмыванию) \nденежных средств, полученных преступным путем, и финансированию терроризма», \nдо отмены такого решения;  \n\uf02d лицо, включенное в составляемые в рамках реализации полномочий, \nпредусмотренных главой VII Устава ООН, Советом Безопасности ООН или \nорганами, специально созданными решениями Совета Безопасности ООН, перечни \nорганизаций и физическ их лиц, связанных с террористическими организациями и \nтеррористами или с распространением оружия массового уничтожения. \n9. Членам Федерации - физическим лицам за особые заслуги в развитии вида спорта \n«практическая стрельба» и (или) выдающиеся спортивные дости жения по виду спорта \n«практическая стрельба» на основании решения Президента Федерации может быть \nприсвоено звание «Почетный член ОСОО « ФПСР». Член Федерации со званием \n«Почетный член ОСОО «ФПСР» освобождается от уплаты членских взносов. \n10. Учет членов Федерации организует Президент Федерации. \n \nIII.', '11.5.2. Разъяснения. Арбитражный к омитет может потребовать от лица, \nподавшего протест, дать пояснения по предоставленным документам и может \nзадавать ему любые вопросы, относящиеся к протесту. \n11.5.3. Слушания. Л ицо, подавшее протест, м огут попросить удалиться, \nпока арбитражный комитет заслушивает дополнительные пояснения. \n11.5.4. Свидетели. Арбитражный к омитет может заслушать официальных \nлиц соревнования, других свидетелей, участвующих в процесс е рассмотрения \nапелляции. Арбитражный к омитет будет изучать все представлен ные \nдоказательства. \n11.5.5. Вопросы. Арбитражный к омитет может задавать свидетелям и \nофициальным лицам любые вопросы, относящиеся к протесту. \n11.5.6. Мнения. Члены арбитражного комитета должны воздерживаться от \nвысказывания мнений и вынесения решений во вр емя процесса рассмотрения \nпротеста. \n11.5.7. Осмотр.', '\uf02d вносить предложения, касающиеся деятельности Федерации, участвовать в их \nобсуждении и реализации; \n\uf02d участвовать в спортивных соревнованиях и мероприятиях по виду спорта \n«практическая с трельба» на территории России и других стран в соответствии с \nправилами данного вида спорта  и регламентами соответствующих спортивных \nсоревнований и мероприятий; \n\uf02d участвовать в учебно-тренировочных мероприятиях, организуемых Федерацией или \nее региональными отделениями, пользоваться спортивно -стрелковыми объектами \nФедерации; \n\uf02d в случае смены места жительства (места пребывания) встать на учет в региональное \nотделение Федерации по новому месту жительства (месту пребывания); \n\uf02d пользоваться программами лояльности партнеров Федерации; \n\uf02d оказывать содействие в организации спортивного соревнования или мероприятия; \n\uf02d выйти из членов Федерации по своему желанию. \n14.', 'Если судья уверен  \nв том, что такое вмешательство оказало значительное воздействие на спортсмена, \nон должен сообщить о случившемся г лавному с удье, который может  указать \nспортсмену перестрелять упражнение. \n8.6.4. Если во время выполнения упражнения внешнее воздействие на \nспортсмена оказал непреднамеренный физический контакт с судьей или с иным \nвнешним фактором, судья может предложить спортсмену перестрелять \nупражнение. Он должен принять или отклонить э то предложение до того, как \nузнает время и очки за эту попытку. Однако, если спортсмен в результате любого \nтакого воздействия нарушил правила безопасности, то могут быть применены \nпункты 10.4 и 10.5. \n8.6.5. В случае, если перед спортсменом в направлении в сторону мишеней \nво время выполнения упражнения появляется человек, выполнение упражнения \nдолжно быть незамедлительно прекращено, а спортсмену назначается перестрел.']","В предоставленном контексте указано, что речь идёт о Федеральном законе от 25.06.2002 № 114‑ФЗ «О противодействии экстремистской деятельности».",В предоставленном тексте упоминается Федеральный закон от 25.06.2002 № 114-ФЗ «О противодействии экстремистской деятельности».,1.0,0.4946770489144166,0.9999999999,1.0,single_hop_specifc_query_synthesizer
"Каковы условия присвоения звания ""Почетный член ОСОО « ФПСР»"" членам Федерации, являющимся физическими лицами, и какие льготы предусмотрены для лиц, обладающих данным статусом, согласно положениям документа?","['7.4 Федерального \nзакона от 07.08.2001 № 115 -ФЗ «О противодействии легализации (отмыванию) \nденежных средств, полученных преступным путем, и финансированию терроризма», \nдо отмены такого решения;  \n\uf02d лицо, включенное в составляемые в рамках реализации полномочий, \nпредусмотренных главой VII Устава ООН, Советом Безопасности ООН или \nорганами, специально созданными решениями Совета Безопасности ООН, перечни \nорганизаций и физическ их лиц, связанных с террористическими организациями и \nтеррористами или с распространением оружия массового уничтожения. \n9. Членам Федерации - физическим лицам за особые заслуги в развитии вида спорта \n«практическая стрельба» и (или) выдающиеся спортивные дости жения по виду спорта \n«практическая стрельба» на основании решения Президента Федерации может быть \nприсвоено звание «Почетный член ОСОО « ФПСР». Член Федерации со званием \n«Почетный член ОСОО «ФПСР» освобождается от уплаты членских взносов. \n10. Учет членов Федерации организует Президент Федерации. \n \nIII.', 'Юридические лица  могут стать членами Федерации при условии, что они выражают \nсолидарность с уставными целями и задачами Федерации, и их уставы не противоречат \nУставу Федерации. \n7. Физические и юридические лица, принятые в члены Федерации до вступления в силу \nнастоящего Положения, сохраняют свое членство без прохождения процедуры \nвступления в члены Федерации, установленной настоящим Положением. \n8. Не могут быть членами Федерации л ица, круг которых определен действующим \nзаконодательством Российской Федерации или актами самой Федерации, включая, в \nтом числе: \n\uf02d лицо, содержащееся в местах лишения свободы по приговору суда;  \n\uf02d лицо, в отношении которого вступившим в законную силу решением  суда \nустановлено, что в его действиях содержатся признаки экстремистской деятельности;  \n\uf02d лицо, признанн ое судом недееспособным  в порядке, установленном гражданским \nпроцессуальным законодательством; \n\uf02d общественное объединение, деятельность которого приостановлена в соот ветствии \nсо ст .', '2. Настоящее Положение принято в соответствии с норм ами действующего \nзаконодательства, включая Федеральный закон от 12.01.1996 № 7 -ФЗ «О  \nнекоммерческих организациях», Федеральный закон от 19.05.1995 № 82 -ФЗ «Об \nобщественных объединениях», Федеральный закон от 13.12.1996 № 150 -ФЗ «Об \nоружии», Федеральный закон от 04.12.2007 № 329-ФЗ «О физической культуре и спорте \nв Российской Федерации», иными нормативно -правовыми актами  Российской \nФедерации и Уставом Федерации. \nВ случае последующего изменения норм законодательства Российской Федерации \nнастоящее Положение действует в части, не противоречащей данным нормам. \n3. Правила настоящего Положения обязательны для всех членов Федерации. \n \nII. ЧЛЕНСТВО В ФЕДЕРАЦИИ \n \n4. Членство в Федерации является добровольным. \n5. Членство в Федерации неотчуждаемо. Осуществление прав члена Федерации не может \nбыть передано другому лицу. \n6.', '31. Юридические лица, желающие вступить в члены Федерации, подают письменное \nзаявление на имя Президента Федерации о приеме в члены ФПСР , в котором должно \nбыть указано: полное наименование юридического лица, адрес юридического лица , \nкоды ОКВЭД, согласие с Уставом Федерации и обязательство соблюдать данный Устав \nи другие нормативные акты Федерации. \n32.', 'которые существенно затрудняют или делают \nневозможным достижение целей, ради которых создана Федерация; \n\uf02d Не разглашать конфиденциальную информацию о деятельности Федерации; \n\uf02d Сообщать об изменениях учредительных документов, реквизитов и иных контактных \nданных; \n\uf02d Не распространять сведения, порочащие честь, достоинство и (или) деловую \nрепутацию Федерации, а также работников и лиц, входящих в ее органы управления в \n\n[Page 5]\n5 \n \nсредствах массовой информации. \n \nV. ПОРЯДОК ВСТУПЛЕНИЯ В ЧЛЕНЫ ФЕДЕРАЦИИ \n \n20. Физические лица, желающие вступи ть в члены Федерации (далее – кандидат в члены \nФедерации), проходят электронную процедуру подачи заявки на вступление в члены \nФедерации. \n21. Для вступления в члены Федерации кандидату в члены Федерации необходимо: \n21.1. Пройти (успешно завершить) курсы безопасного и  квалифицированного \nобращения с оружием (далее – БЕКОСО) у инструктора ФПСР (список \nинструкторов ФПСР опубликован на сайте Федерации в сети Интернет по ссылке \nhttps://ipsc.ru/).']","Звание «Почетный член ОСОО «ФПСР» может быть присвоено физическим лицам‑членам Федерации за особые заслуги в развитии вида спорта «практическая стрельба» и/или выдающиеся спортивные достижения в этом виде спорта на основании решения Президента Федерации. Лица, получившие данное звание, освобождаются от уплаты членских взносов.","Звание ""Почетный член ОСОО « ФПСР»"" может быть присвоено членам Федерации — физическим лицам за особые заслуги в развитии вида спорта «практическая стрельба» и (или) выдающиеся спортивные достижения по виду спорта «практическая стрельба» на основании решения Президента Федерации. Член Федерации со званием «Почетный член ОСОО «ФПСР» освобождается от уплаты членских взносов.",1.0,0.8808000000394346,0.9999999999,1.0,single_hop_specifc_query_synthesizer
права членов ФПСР согласно Уставу,"['10. Учет членов Федерации организует Президент Федерации. \n \nIII. ПРАВА ЧЛЕНОВ ФЕДЕРАЦИИ \n \n11. Все члены Федерации пользуются равными правами в соответствии с Уставом , \nПоложением и иными нормативными актами Федерации. \n\n[Page 3]\n3 \n \n12. Права члена Федерации возникают с момента принятия решения Президе нта о \nвступлении его в Федерацию. Прекращение членства ведёт к прекращению всех прав по \nотношению к ФПСР в соответствии с действующим законодательством Российской \nФедерации. \n13. Члены Федерации - физические лица имеют право: \n\uf02d участвовать в управлении делами Федерации, избирать и быть избранными в \nруководящие и контрольно -ревизионные органы Федерации в соответствии с \nУставом Федерации и иными нормативными актами Федерации; \n\uf02d получать информацию о деятельности Федерации и знакомиться с ее бухгалтерской \nи иной документацией по письменному запросу, направляемому Президенту \nФедерации; \n\uf02d вносить предложения, касающиеся деятельности Федерации, участвовать в их \nобсуждении и реализации;', '\uf02d выйти из членов Федерации по своему желанию. \n14. Члены Федерации - юридические лица имеют право: \n\uf02d получать информацию о деятельности Федерации и знакомиться с ее бухг алтерской \nи иной документацией по письменному запросу, направляемому Президенту \nФедерации; \n\uf02d вносить предложения, касающиеся деятельности Федерации, участвовать в их \nобсуждении и реализации; \n\uf02d пользоваться спортивными и образовательными программами Федерации; \n\uf02d проводить спортивные мероприятия по виду спорта «практическая стрельба»  в \nсоответствии с правилами данного вида спорта , положениями  и регламентами \nсоответствующих спортивных соревнований и мероприятий; \n\uf02d подавать заявки на проведение официальных спортивных с оревнований и \nучебно-тренировочных мероприятий муниципального, регионального, \nмежрегионального, всероссийского и международного уровней; \n\uf02d направлять своих членов или участников для участия в муниципальных и \nрегиональных мероприятиях; \n\uf02d выйти из членов Федерации по своему желанию. \n15.', '15. Члены Федерации при наличии задолженности по членским взносам за текущий год не \nимеют права: \n\uf02d требовать внесения изменений в свою учетную запись  личного кабинета члена \nФедерации; \n\uf02d на выдачу и продление удостоверения члена Федерации, в том числе электронного; \n\n[Page 4]\n4 \n \n\uf02d оформлять переход в другое региональное отделение Федерации. \n \nIV. ОБЯЗАННОСТИ ЧЛЕНОВ ФЕДЕРАЦИИ \n \n16. Все члены Федерации несут равные обязанности в соответствии с Уставом, \nПоложением и иными нормативными актами Федерации. \n17. Обязанности члена Федерации возникают с момента принятия решения Президента о \nвступлении его в Федерацию . Прекращение членства ведёт к прекращению всех \nобязанностей по отношению к ФПСР в соответствии с действующим \nзаконодательством Российской Федерации, за исключением обязанности по оплате \nнеуплаченных ранее членских взносов. \n18. Члены Федерации - физические лица обязаны: \n\uf02d Своевременно уплачивать вступительные, членские и целевые взносы в порядке и \nразмере,', 'Юридические лица  могут стать членами Федерации при условии, что они выражают \nсолидарность с уставными целями и задачами Федерации, и их уставы не противоречат \nУставу Федерации. \n7. Физические и юридические лица, принятые в члены Федерации до вступления в силу \nнастоящего Положения, сохраняют свое членство без прохождения процедуры \nвступления в члены Федерации, установленной настоящим Положением. \n8. Не могут быть членами Федерации л ица, круг которых определен действующим \nзаконодательством Российской Федерации или актами самой Федерации, включая, в \nтом числе: \n\uf02d лицо, содержащееся в местах лишения свободы по приговору суда;  \n\uf02d лицо, в отношении которого вступившим в законную силу решением  суда \nустановлено, что в его действиях содержатся признаки экстремистской деятельности;  \n\uf02d лицо, признанн ое судом недееспособным  в порядке, установленном гражданским \nпроцессуальным законодательством; \n\uf02d общественное объединение, деятельность которого приостановлена в соот ветствии \nсо ст .', 'Членство в Федерации неотчуждаемо. Осуществление прав члена Федерации не может \nбыть передано другому лицу. \n6. Членами Федерации могут быть признающие и разделяющие цели и задачи Федерации, \nсодействующие деятельности Федерации, своевременно уплачивающие вступительный \nи членские взносы, признающие и соблюдающие Устав, р егламенты, положения и \nрешения Федерации: \n6.1. физические лица – граждане Российской Федерации, достигшие возраста 18 лет; \n6.2. юридические лица: \n\uf02d общественные объединения (региональные спортивные федерации практической \nстрельбы и иные общественные объединения, осуществляющие свою деятельность \nпреимущественно в виде спорта «практическая стрельба»); \n\n[Page 2]\n2 \n \n\uf02d спортивные клубы, независимо от их организационно -правовых форм, а также \nобъединения организаций, осуществляющи е свою деятельность в области спорта и \nразвивающие вид спорта «практическая стрельба».']","Согласно Уставу и Положению о членстве ОСОО ФПСР все члены Федерации пользуются равными правами.  

**Для физических лиц:**  
- участвовать в управлении делами Федерации, избирать и быть избранными в руководящие и контрольно‑ревизионные органы;  
- получать информацию о деятельности Федерации и знакомиться с её бухгалтерской и иной документацией по письменному запросу Президенту;  
- вносить предложения, касающиеся деятельности Федерации, участвовать в их обсуждении и реализации;  
- выйти из членов Федерации по своему желанию.  

**Для юридических лиц:**  
- получать информацию о деятельности Федерации и знакомиться с её бухгалтерской и иной документацией по письменному запросу Президенту;  
- вносить предложения, касающиеся деятельности Федерации, участвовать в их обсуждении и реализации;  
- пользоваться спортивными и образовательными программами Федерации;  
- проводить спортивные мероприятия по виду спорта «практическая стрельба» в соответствии с правилами, положениями и регламентами соответствующих соревнований;  
- подавать заявки на проведение официальных спортивных соревнований и учебно‑тренировочных мероприятий муниципального, регионального, межрегионального, всероссийского и международного уровней;  
- направлять своих членов или участников для участия в муниципальных и региональных мероприятиях;  
- выйти из членов Федерации по своему желанию.  

Права возникают с момента принятия решения Президента о вступлении в Федерацию и прекращаются при прекращении членства (за исключением обязанности по оплате неуплаченных ранее взносов). При наличии задолженности по членским взносам за текущий год члены лишаются права требовать внесения изменений в учётную запись личного кабинета, получать/продлевать удостоверение члена Федерации и оформлять переход в другое региональное отделение.","Все члены Федерации пользуются равными правами в соответствии с Уставом, Положением и иными нормативными актами Федерации. Физические лица, являющиеся членами Федерации, имеют право участвовать в управлении делами Федерации, избирать и быть избранными в руководящие и контрольно-ревизионные органы Федерации (согласно Уставу Федерации и иным нормативным актам), получать информацию о деятельности Федерации и знакомиться с ее бухгалтерской и иной документацией по письменному запросу к Президенту Федерации, а также вносить предложения, касающиеся деятельности Федерации, и участвовать в их обсуждении и реализации.",1.0,0.8950699091524251,0.99999999995,1.0,single_hop_specifc_query_synthesizer
Какие права имеют члены Федерации в отношении участия в соревнованиях и мероприятиях по практической стрельбе на территории России?,"['Членство в Федерации неотчуждаемо. Осуществление прав члена Федерации не может \nбыть передано другому лицу. \n6. Членами Федерации могут быть признающие и разделяющие цели и задачи Федерации, \nсодействующие деятельности Федерации, своевременно уплачивающие вступительный \nи членские взносы, признающие и соблюдающие Устав, р егламенты, положения и \nрешения Федерации: \n6.1. физические лица – граждане Российской Федерации, достигшие возраста 18 лет; \n6.2. юридические лица: \n\uf02d общественные объединения (региональные спортивные федерации практической \nстрельбы и иные общественные объединения, осуществляющие свою деятельность \nпреимущественно в виде спорта «практическая стрельба»); \n\n[Page 2]\n2 \n \n\uf02d спортивные клубы, независимо от их организационно -правовых форм, а также \nобъединения организаций, осуществляющи е свою деятельность в области спорта и \nразвивающие вид спорта «практическая стрельба».', '\uf02d выйти из членов Федерации по своему желанию. \n14. Члены Федерации - юридические лица имеют право: \n\uf02d получать информацию о деятельности Федерации и знакомиться с ее бухг алтерской \nи иной документацией по письменному запросу, направляемому Президенту \nФедерации; \n\uf02d вносить предложения, касающиеся деятельности Федерации, участвовать в их \nобсуждении и реализации; \n\uf02d пользоваться спортивными и образовательными программами Федерации; \n\uf02d проводить спортивные мероприятия по виду спорта «практическая стрельба»  в \nсоответствии с правилами данного вида спорта , положениями  и регламентами \nсоответствующих спортивных соревнований и мероприятий; \n\uf02d подавать заявки на проведение официальных спортивных с оревнований и \nучебно-тренировочных мероприятий муниципального, регионального, \nмежрегионального, всероссийского и международного уровней; \n\uf02d направлять своих членов или участников для участия в муниципальных и \nрегиональных мероприятиях; \n\uf02d выйти из членов Федерации по своему желанию. \n15.', '\uf02d вносить предложения, касающиеся деятельности Федерации, участвовать в их \nобсуждении и реализации; \n\uf02d участвовать в спортивных соревнованиях и мероприятиях по виду спорта \n«практическая с трельба» на территории России и других стран в соответствии с \nправилами данного вида спорта  и регламентами соответствующих спортивных \nсоревнований и мероприятий; \n\uf02d участвовать в учебно-тренировочных мероприятиях, организуемых Федерацией или \nее региональными отделениями, пользоваться спортивно -стрелковыми объектами \nФедерации; \n\uf02d в случае смены места жительства (места пребывания) встать на учет в региональное \nотделение Федерации по новому месту жительства (месту пребывания); \n\uf02d пользоваться программами лояльности партнеров Федерации; \n\uf02d оказывать содействие в организации спортивного соревнования или мероприятия; \n\uf02d выйти из членов Федерации по своему желанию. \n14.', '39. Принятие физического лица в члена Федерации автоматически делает его членом \n(участником) Международной Конфедерации Практической Стрельбы ( International \nPractical Shooting Confederation – IРSС). \nФедерация возлагает на себя обязанность по обеспечению всех необходимых условий \nдля поддержания и сохранения членами Федер ации - физическими лицами статуса \nчлена (участника) IРSС, в том числе по оплате необходимых взносов. \n \nVI. ПОРЯДОК ПРЕКРАЩЕНИЯ ЧЛЕНСТВА В ФЕДЕРАЦИИ \n \n40. Президент Федерации принимает решение об исключении из членов Фед ерации (в том \nчисле членов Федерации со званием «Почетный член ОСОО «ФПСР»)  по следующим \nоснованиям: \n\uf02d В связи с неуплатой членских взносов в течение 1 (одного) года; \n\uf02d По собственному желанию члена Федерации. \n41. Член Федерации прекращает свое членство в Федерации по собственному желанию \nпутем подачи письменного заявления Президенту Федерации.', '[Page 1]\n1 \n \nОБЩЕРОССИЙСКАЯ СПОРТИВНАЯ ОБЩЕСТВЕННАЯ ОРГАНИЗАЦИЯ \nПО РАЗВИТИЮ СТРЕЛКОВЫХ ВИДОВ СПОРТА \n«ФЕДЕРАЦИЯ ПРАКТИЧЕСКОЙ СТРЕЛЬБЫ РОССИИ» \n \nУтверждено решением \nИсполнительного комитета \nОСОО «ФПСР» \nот 22.08.2023 \n \n \n \nПОЛОЖЕНИЕ О ЧЛЕНСТВЕ В ОСОО «ФПСР» \n \n \nI. ОБЩИЕ ПОЛОЖЕНИЯ \n \n1. Настоящее Положение о членстве (далее – Положение) определяет условия и порядок \nприема в члены, исключения (выхода) из членов, порядок уплаты членских и иных \nвзносов, а также права, обязанности и ответственность членов Общероссийской \nспортивной общественной организации по развитию стрелковых видов спорта \n«Федерация практической стрельбы России» (далее – Федерация, ФПСР). \n2.']",Члены Федерации (физические лица) имеют право участвовать в спортивных соревнованиях и мероприятиях по виду спорта «практическая стрельба» на территории России (и других стран) в соответствии с правилами данного вида спорта и регламентами соответствующих спортивных соревнований и мероприятий.,Члены Федерации имеют право участвовать в спортивных соревнованиях и мероприятиях по виду спорта «практическая стрельба» на территории России и других стран в соответствии с правилами данного вида спорта и регламентами соответствующих спортивных соревнований и мероприятий.,1.0,0.9270251204586962,,,single_hop_specifc_query_synthesizer
"А если я компания, то кому писать, чтобы поглядеть бумажки по деньгам, Президенту Федреции?","['32. Вместе с письменным заявлением юридические  лица предоставляют следующие \nдокументы: \n\uf02d Протокол о решении вступить в Федерацию уполномоченного органа юридического \nлица, к компетенции которого уставом этого юридического лица отнесено принятие \nданного решения; \n\uf02d Нотариально заверенная копия действующего устава юридического лица и \nизменений к нему; \n\uf02d Нотариально заверенная копия с видетельства о государственной регистрации  \nюридического лица; \n\uf02d Нотариально заверенная копия с видетельства о постановке на учет в налоговом \nоргане юридического лица; \n\uf02d Нотариально завер енная копия выписки из единого государственного реестра \nюридический лиц; \n\uf02d Платежное поручение об оплате вступительного и членского взносов  (членский \nвзнос необходимо оплатить на срок не менее чем за один год  по реквизитам, \nуказанным на сайте Федерации в разделе «Реквизиты» , и в размере, указанном в \nГлаве 7 настоящего Положения). \n33. Вышеуказанные документы юридическое лицо направляет непосредственно в  \nФедерацию на имя Президента Федерации. \n34.', '34. Президент Федерации информирует Председателя регионального \nотделения/Руководителя аккредитованного РСОО по месту нахождения юридического \nлица о поступлении документов на вступление юридического лица в члены Федерации. \nПредседатель регионального отделения /Руководитель аккредитованного РСОО по \nместу нахождения юридического лица имеет право  направить рекомендацию (скан) о \nпринятии (непринятии) юридического лица в члены Федерации  в течение 10 (десяти) \nрабочих дней с момента информирования Президентом Федерации. \nОтрицательная рекомендация должна быть мотивированной.  \nРекомендация Председателя регионального отделения/Руководителя аккредитованного \nРСОО не носит обязательного характера для Президента Федерации. \n35. Президент Федерации не позднее конца месяца, следующего за месяцем приема \nдокументов от юридического лица , принимает решение о принятии (непринятии) в \nчлены Федерации юридического лица. \n36. В случае отказа в принятии в члены Федерации уплаченные кандидатом взносы \nподлежат возврату. \n37.', '31. Юридические лица, желающие вступить в члены Федерации, подают письменное \nзаявление на имя Президента Федерации о приеме в члены ФПСР , в котором должно \nбыть указано: полное наименование юридического лица, адрес юридического лица , \nкоды ОКВЭД, согласие с Уставом Федерации и обязательство соблюдать данный Устав \nи другие нормативные акты Федерации. \n32.', '25. Председатель регионального отделения /Руководитель аккредитованного РСОО  в \nтечение 5 (пяти) рабочих дней, включая дату получения документов кандидата в члены \nФедерации от инструктора ФПСР, после проверки всех документов должен направить в \nэлектронном виде Президенту Федерации  рекомендацию (скан) о принятии  \n(непринятии) кандидата в члены Федерации. \nОтрицательная рекомендация должна быть мотивированной на основании п.  8 \nПоложения. \nРекомендация Председателя регионального отделения/Руководителя аккредитованного \nРСОО не носит обязательного характера для Президента Федерации. \n26. Президент Федерации  не позднее конца месяца, следующего за месяцем получения \nэлектронного заявления  (анкеты) от кандидата в члены Федерации , проверяет \nдокументы и принимает решение о принятии  (непринятии) в члены Федерации \nфизического лица путем подтверждения (отклонения) электронного заявления (анкеты) \nкандидата в члены Федерации из сво его личного кабинета на сайте Федерации в се ти \nИнтернет ( https://ipsc.ru/).', 'По факту подтверждения электронного заявления (анкеты) \nкандидата в члены Федерации у принятого члена Федерации появится отметка в личном \nкабинете о дате и времени приема в члены Федерации. По факту отклонения \nэлектронного заявления (анкеты) кандидата в члены Федерации у непринятого члена \nФедерации появится отметка о дате и времени отклонения приема в члены Федерации \n27. В случае отказа в принятии в члены Федерации уплаченные кандидатом взносы \nподлежат возврату на основании заявления о возврате денежных средств, поданного в \nустановленной форме на имя Президента Федерации. \n28. Для целей перехода из одного региона льного отделения /РСОО в другое члену \nФедерации - физическому лицу необходимо заполнить в личном каби нете на сайте \nФедерации электронную форму заявления о смене регионального отделения и ожидать \nподтверждение от Председателя регионального отделения /Руководителя \nаккредитованного РСОО, в которое переходит физическое лицо. На момент заполнения \nзаявления у члена Федерации - физического лица не должно быть задолженностей по \nчленским взносам.']",Юридическое лицо (компания) должно направлять документы непосредственно в Федерацию на имя Президента Федерации.,"Юридические лица, являющиеся членами Федерации, имеют право знакомиться с бухгалтерской и иной документацией по письменному запросу, направляемому Президенту Федерации.",,,,,single_hop_specifc_query_synthesizer
Какии правыла прекращения обязнностей члена Федреции по закодательству Росийской Федерации?,"['15. Члены Федерации при наличии задолженности по членским взносам за текущий год не \nимеют права: \n\uf02d требовать внесения изменений в свою учетную запись  личного кабинета члена \nФедерации; \n\uf02d на выдачу и продление удостоверения члена Федерации, в том числе электронного; \n\n[Page 4]\n4 \n \n\uf02d оформлять переход в другое региональное отделение Федерации. \n \nIV. ОБЯЗАННОСТИ ЧЛЕНОВ ФЕДЕРАЦИИ \n \n16. Все члены Федерации несут равные обязанности в соответствии с Уставом, \nПоложением и иными нормативными актами Федерации. \n17. Обязанности члена Федерации возникают с момента принятия решения Президента о \nвступлении его в Федерацию . Прекращение членства ведёт к прекращению всех \nобязанностей по отношению к ФПСР в соответствии с действующим \nзаконодательством Российской Федерации, за исключением обязанности по оплате \nнеуплаченных ранее членских взносов. \n18. Члены Федерации - физические лица обязаны: \n\uf02d Своевременно уплачивать вступительные, членские и целевые взносы в порядке и \nразмере,', '46. Решение об исключении из Федерации считается принятым, если за него проголосовало \nне менее 2/3 (двух третей) членов Исполнительного комитета Федерации, \nучаствовавших в заседании Исполнительного комитета Федерации. \n47. При исключении из членов Федерации по решению Исполни тельного комитета \nФедерации у лица не возникает права на возврат уплаченных взносов. \n48. Членство юридического лица в Федерации прекращается в случае ликвидации члена \nФедерации - юридического лица (исключения из единого государственного реестра \nюридических лиц ). Принятие решения по данному вопросу соответствующих \nруководящих органов ФПСР не требуется, а права и обязанности члена Федерации \nпрекращаются с момента внесения записи о ликвидации юридического лица в Единый \nгосударственный реестр юридических лиц. \n49. Повторное принятие в члены Федерации ранее исключенных лиц возможно  по \nистечении сроков, указанных в решении об исключении (предельный срок \nустанавливается в размере 5 лет, пожизненный срок – является самостоятельной \nсанкцией).', '10. Учет членов Федерации организует Президент Федерации. \n \nIII. ПРАВА ЧЛЕНОВ ФЕДЕРАЦИИ \n \n11. Все члены Федерации пользуются равными правами в соответствии с Уставом , \nПоложением и иными нормативными актами Федерации. \n\n[Page 3]\n3 \n \n12. Права члена Федерации возникают с момента принятия решения Президе нта о \nвступлении его в Федерацию. Прекращение членства ведёт к прекращению всех прав по \nотношению к ФПСР в соответствии с действующим законодательством Российской \nФедерации. \n13. Члены Федерации - физические лица имеют право: \n\uf02d участвовать в управлении делами Федерации, избирать и быть избранными в \nруководящие и контрольно -ревизионные органы Федерации в соответствии с \nУставом Федерации и иными нормативными актами Федерации; \n\uf02d получать информацию о деятельности Федерации и знакомиться с ее бухгалтерской \nи иной документацией по письменному запросу, направляемому Президенту \nФедерации; \n\uf02d вносить предложения, касающиеся деятельности Федерации, участвовать в их \nобсуждении и реализации;', '39. Принятие физического лица в члена Федерации автоматически делает его членом \n(участником) Международной Конфедерации Практической Стрельбы ( International \nPractical Shooting Confederation – IРSС). \nФедерация возлагает на себя обязанность по обеспечению всех необходимых условий \nдля поддержания и сохранения членами Федер ации - физическими лицами статуса \nчлена (участника) IРSС, в том числе по оплате необходимых взносов. \n \nVI. ПОРЯДОК ПРЕКРАЩЕНИЯ ЧЛЕНСТВА В ФЕДЕРАЦИИ \n \n40. Президент Федерации принимает решение об исключении из членов Фед ерации (в том \nчисле членов Федерации со званием «Почетный член ОСОО «ФПСР»)  по следующим \nоснованиям: \n\uf02d В связи с неуплатой членских взносов в течение 1 (одного) года; \n\uf02d По собственному желанию члена Федерации. \n41. Член Федерации прекращает свое членство в Федерации по собственному желанию \nпутем подачи письменного заявления Президенту Федерации.', 'К заявлению члена \nФедерации, являющег ося юридическим лицом, прилагается решение о выходе из \nчленов Федерации уполномоченного органа юридического лица, к компетенции \nкоторого уставом этого юридического лица отнесено принятие данного решения. \n42. Член Федерации считается выбывшим из нее по собствен ному желанию с момента \nпринятия решения Президент ом об исключении из членов Федерации , либо по \nистечении месяца с даты подачи заявления.  \n43. Исключение из членов Федерации в связи с неуплатой членских взносов в течение 1 \n(одного) года  не освобождает от обязан ности оплатить задолженность по членским \nвзносам, образовавшуюся в период членства в Федерации. \n44. Исполнительный комитет принимает решение об исключении из членов Федерации (в \nтом числе членов Федерации со званием «Почетный член ОСОО «ФПСР»)  по \nследующим основаниям: \n\uf02d возникновение обстоятельств, в силу которых лицо не может быть членом \nФедерации (см. п.']","Прекращение членства в Федерации приводит к прекращению всех прав и обязанностей члена по отношению к ФПСР в соответствии с действующим законодательством Российской Федерации, за исключением обязанности оплатить ранее неуплаченные членские взносы.","Прекращение членства ведёт к прекращению всех обязанностей по отношению к ФПСР в соответствии с действующим законодательством Российской Федерации, за исключением обязанности по оплате неуплаченных ранее членских взносов.",,,,,single_hop_specifc_query_synthesizer
Какие обязнности и запрты имею члены ФПСР в отношении репутации и авторитета ФПСР?,"['порочащие деловую репутацию Федерации, а также \nчесть, достоинство членов, работников и лиц, входящих в ее органы управления в \nсредствах массовой информации. (данный абзац переписан в другой стилистической \nформулировке не изменяющей сути вопроса) \n19. Члены Федерации - юридические лица обязаны: \n\uf02d Своевременно уплачивать вступительные, членские и целевые взносы в порядке и \nразмере, установленным решением Конференции и настоящим Положением; \n\uf02d Выполнять решения руководящих органов Федерации; \n\uf02d Соблюдать Устав Федерации и иные регулирующие деятельность Федерации акты; \n\uf02d Воздерживаться от деятельности, противоречащей целям и задачам Федерации; \n\uf02d Не совершать действий (бездействий), нарушающих Устав Федерации, этику \nспортивных и товарищеских взаимоотно шений, а также действий, наносящих \nрепутационный и материальный ущерб Федерации; \n\uf02d Не совершать действий (бездействий), которые существенно затрудняют или делают \nневозможным достижение целей, ради которых создана Федерация;', '15. Члены Федерации при наличии задолженности по членским взносам за текущий год не \nимеют права: \n\uf02d требовать внесения изменений в свою учетную запись  личного кабинета члена \nФедерации; \n\uf02d на выдачу и продление удостоверения члена Федерации, в том числе электронного; \n\n[Page 4]\n4 \n \n\uf02d оформлять переход в другое региональное отделение Федерации. \n \nIV. ОБЯЗАННОСТИ ЧЛЕНОВ ФЕДЕРАЦИИ \n \n16. Все члены Федерации несут равные обязанности в соответствии с Уставом, \nПоложением и иными нормативными актами Федерации. \n17. Обязанности члена Федерации возникают с момента принятия решения Президента о \nвступлении его в Федерацию . Прекращение членства ведёт к прекращению всех \nобязанностей по отношению к ФПСР в соответствии с действующим \nзаконодательством Российской Федерации, за исключением обязанности по оплате \nнеуплаченных ранее членских взносов. \n18. Члены Федерации - физические лица обязаны: \n\uf02d Своевременно уплачивать вступительные, членские и целевые взносы в порядке и \nразмере,', '10. Учет членов Федерации организует Президент Федерации. \n \nIII. ПРАВА ЧЛЕНОВ ФЕДЕРАЦИИ \n \n11. Все члены Федерации пользуются равными правами в соответствии с Уставом , \nПоложением и иными нормативными актами Федерации. \n\n[Page 3]\n3 \n \n12. Права члена Федерации возникают с момента принятия решения Президе нта о \nвступлении его в Федерацию. Прекращение членства ведёт к прекращению всех прав по \nотношению к ФПСР в соответствии с действующим законодательством Российской \nФедерации. \n13. Члены Федерации - физические лица имеют право: \n\uf02d участвовать в управлении делами Федерации, избирать и быть избранными в \nруководящие и контрольно -ревизионные органы Федерации в соответствии с \nУставом Федерации и иными нормативными актами Федерации; \n\uf02d получать информацию о деятельности Федерации и знакомиться с ее бухгалтерской \nи иной документацией по письменному запросу, направляемому Президенту \nФедерации; \n\uf02d вносить предложения, касающиеся деятельности Федерации, участвовать в их \nобсуждении и реализации;', 'членские и целевые взносы в порядке и \nразмере, установленном решением Конференции и настоящим Положением; \n\uf02d Выполнять решения руководящих органов Федерации; \n\uf02d Соблюдать Устав Федерации и иные регулирующие деятельность Федерации акты; \n\uf02d Воздерживаться от деятельности, противоречащей целям и задачам Федерации; \n\uf02d Не совершать действий (бездействий), нарушающих Устав Федерации, этику  \nспортивных и товарищеских взаимоотношений, подрывающих авторитет ФПСР, а \nтакже действий, наносящих репутационный и материальный ущерб Федерации; \n\uf02d Не совершать действий (бездействий), которые существенно затрудняют или делают \nневозможным достижение целей, ради которых создана Федерация; \n\uf02d Не разглашать конфиденциальную информацию о деятельности Федерации; \n\uf02d Вносить необходимые изменения в учетную запись личного кабинета члена \nФедерации в случае смены персональных и иных контактных данных; \n\uf02d Не распространять сведения, порочащие деловую репутацию Федерации, а также \nчесть, достоинство членов, работников и лиц,', 'которые существенно затрудняют или делают \nневозможным достижение целей, ради которых создана Федерация; \n\uf02d Не разглашать конфиденциальную информацию о деятельности Федерации; \n\uf02d Сообщать об изменениях учредительных документов, реквизитов и иных контактных \nданных; \n\uf02d Не распространять сведения, порочащие честь, достоинство и (или) деловую \nрепутацию Федерации, а также работников и лиц, входящих в ее органы управления в \n\n[Page 5]\n5 \n \nсредствах массовой информации. \n \nV. ПОРЯДОК ВСТУПЛЕНИЯ В ЧЛЕНЫ ФЕДЕРАЦИИ \n \n20. Физические лица, желающие вступи ть в члены Федерации (далее – кандидат в члены \nФедерации), проходят электронную процедуру подачи заявки на вступление в члены \nФедерации. \n21. Для вступления в члены Федерации кандидату в члены Федерации необходимо: \n21.1. Пройти (успешно завершить) курсы безопасного и  квалифицированного \nобращения с оружием (далее – БЕКОСО) у инструктора ФПСР (список \nинструкторов ФПСР опубликован на сайте Федерации в сети Интернет по ссылке \nhttps://ipsc.ru/).']","We need to answer based on the provided context. The question: ""Какие обязнности и запрты имею члены ФПСР в отношении репутации и авторитета ФПСР?"" Likely typo: ""обязанности и права"". We need to list obligations and rights concerning reputation and authority of FPSR.

From context: obligations: members must not commit actions (or omissions) that violate the charter, ethics, undermine authority, cause reputational and material damage; must not spread information that tarnishes reputation, honor, dignity of federation, its members, workers, persons in governing bodies in mass media; must not disclose confidential information; must not spread info that tarnishes reputation, honor, dignity; must not commit actions that substantially hinder or make impossible achieving goals; must not commit actions that cause reputational and material damage; must not spread info that tarnishes reputation, honor, dignity; must not spread info that tarnishes reputation, honor, dignity of federation and workers; must not spread info that tarnishes reputation, honor, dignity; must not spread info that tarnishes reputation, honor, dignity; also must not spread info that tarnishes reputation, honor, dignity; also must not spread info that tarnishes reputation, honor, dignity; also must not spread info that tarnishes reputation, honor, dignity; also must not spread info that tarnishes reputation, honor, dignity; also must not spread info that tarnishes reputation, honor, dignity; also must not spread info that tarnishes reputation, honor, dignity; also must not spread info that tarnishes reputation, honor, dignity; also must not spread info that tarnishes reputation, honor, dignity; also must not spread info that tarnishes reputation, honor, dignity; also must not spread info that tarnishes reputation, honor, dignity; also must not spread info that tarnishes reputation, honor, dignity; also must not spread info that tarnishes reputation, honor, dignity; also must not spread info that tarnishes reputation, honor, dignity; also must not spread info that tarnishes reputation, honor, dignity; also must not spread info that tarnishes reputation, honor, dignity; also must not spread info that tarnishes reputation, honor, dignity; also must not spread info that tarnishes reputation, honor, dignity; also must not spread info that tarnishes reputation, honor, dignity; also must not spread info that tarnishes reputation, honor, dignity; also must not spread info that tarnishes reputation, honor, dignity; also must not spread info that tarnishes reputation, honor, dignity; also must not spread info that tarnishes reputation, honor, dignity; also must not spread info that tarnishes reputation, honor, dignity; also must not spread info that tarnishes reputation, honor, dignity; also must not spread info that tarnishes reputation, honor, dignity; also must not spread info that tarnishes reputation, honor, dignity; also must not spread info that tarnishes reputation, honor, dignity; also must not spread info that tarnishes reputation, honor, dignity; also must not spread info that tarnishes reputation, honor, dignity; also must not spread info that tarnishes reputation, honor, dignity; also must not spread info that tarnishes reputation, honor, dignity; also must not spread info that tarnishes reputation, honor, dignity; also must not spread info that tarnishes reputation, honor, dignity; also must not spread info that tarnishes reputation, honor, dignity; also must not spread info that tarnishes reputation, honor, dignity; also must not spread info that tarnishes reputation, honor, dignity; also must not spread info that tarnishes reputation, honor, dignity; also must not spread info that tarnishes reputation, honor, dignity; also must not spread info that tarnishes reputation, honor, dignity; also must not spread info that tarnishes reputation, honor, dignity; also must not spread info that tarnishes reputation, honor, dignity; also must not spread info that tarnishes reputation, honor, dignity; also must not spread info that tarnishes reputation, honor, dignity; also must not spread info that tarnishes reputation, honor, dignity; also must not spread info that tarnishes reputation, honor, dignity; also must not spread info that tarnishes reputation, honor, dignity; also must not spread info that tarnishes reputation, honor, dignity; also must not spread info that tarnishes reputation, honor, dignity; also must not spread info that tarnishes reputation, honor, dignity; also must not spread info that tarnishes reputation, honor, dignity; also must not spread info that tarnishes reputation, honor, dignity; also must not spread info that tarnishes reputation, honor, dignity; also must not spread info that t","Члены Федерации обязаны не совершать действий (бездействий), подрывающих авторитет ФПСР, а также действий, наносящих репутационный и материальный ущерб Федерации, и не распространять сведения, порочащие деловую репутацию Федерации, а также честь, достоинство членов, работников и лиц.",,,,,single_hop_specifc_query_synthesizer
какие обязательства членов Федерации по уплате взносов определяются решением Конференции?,"['15. Члены Федерации при наличии задолженности по членским взносам за текущий год не \nимеют права: \n\uf02d требовать внесения изменений в свою учетную запись  личного кабинета члена \nФедерации; \n\uf02d на выдачу и продление удостоверения члена Федерации, в том числе электронного; \n\n[Page 4]\n4 \n \n\uf02d оформлять переход в другое региональное отделение Федерации. \n \nIV. ОБЯЗАННОСТИ ЧЛЕНОВ ФЕДЕРАЦИИ \n \n16. Все члены Федерации несут равные обязанности в соответствии с Уставом, \nПоложением и иными нормативными актами Федерации. \n17. Обязанности члена Федерации возникают с момента принятия решения Президента о \nвступлении его в Федерацию . Прекращение членства ведёт к прекращению всех \nобязанностей по отношению к ФПСР в соответствии с действующим \nзаконодательством Российской Федерации, за исключением обязанности по оплате \nнеуплаченных ранее членских взносов. \n18. Члены Федерации - физические лица обязаны: \n\uf02d Своевременно уплачивать вступительные, членские и целевые взносы в порядке и \nразмере,', 'членские и целевые взносы в порядке и \nразмере, установленном решением Конференции и настоящим Положением; \n\uf02d Выполнять решения руководящих органов Федерации; \n\uf02d Соблюдать Устав Федерации и иные регулирующие деятельность Федерации акты; \n\uf02d Воздерживаться от деятельности, противоречащей целям и задачам Федерации; \n\uf02d Не совершать действий (бездействий), нарушающих Устав Федерации, этику  \nспортивных и товарищеских взаимоотношений, подрывающих авторитет ФПСР, а \nтакже действий, наносящих репутационный и материальный ущерб Федерации; \n\uf02d Не совершать действий (бездействий), которые существенно затрудняют или делают \nневозможным достижение целей, ради которых создана Федерация; \n\uf02d Не разглашать конфиденциальную информацию о деятельности Федерации; \n\uf02d Вносить необходимые изменения в учетную запись личного кабинета члена \nФедерации в случае смены персональных и иных контактных данных; \n\uf02d Не распространять сведения, порочащие деловую репутацию Федерации, а также \nчесть, достоинство членов, работников и лиц,', 'В отношении исключенных лиц за неуплату членских взносов  повторное \nпринятие возможно на общих основаниях при условии оплаты всей задолженности по \nчленским взносам, образовавшейся в период членства до исключения из Федерации.  \n \nVII. ПОРЯДОК УПЛАТЫ ЧЛЕНСКИХ И ИНЫХ ВЗНОСОВ И ИХ \nРАСПРЕДЕЛЕНИЯ \n \n50. В отношении членов Федерации, оплативших членские взносы, в том числе частично, в \nединой регистрационной системе учета членов Федерации делается соответствующая \nотметка. \n51. Размер и порядок уплаты членских и вступительных взносов для физических лиц: \n51.1. Вступительный взнос составляет 2 000,00 руб. \n51.2. Вступительный взнос для ветеранов боевых действий составляет 1  000,00 руб. \nКатегория «ветеран боевых действий» должна подтверждаться \nсоответствующими документами. \n\n[Page 10]\n10 \n \n51.3. Вступительный взнос у плачивается единовременно при вступлении в члены \nФедерации. \n51.4. Ежегодный членский взнос составляет 3 000,00 руб. \n51.5.', 'К заявлению члена \nФедерации, являющег ося юридическим лицом, прилагается решение о выходе из \nчленов Федерации уполномоченного органа юридического лица, к компетенции \nкоторого уставом этого юридического лица отнесено принятие данного решения. \n42. Член Федерации считается выбывшим из нее по собствен ному желанию с момента \nпринятия решения Президент ом об исключении из членов Федерации , либо по \nистечении месяца с даты подачи заявления.  \n43. Исключение из членов Федерации в связи с неуплатой членских взносов в течение 1 \n(одного) года  не освобождает от обязан ности оплатить задолженность по членским \nвзносам, образовавшуюся в период членства в Федерации. \n44. Исполнительный комитет принимает решение об исключении из членов Федерации (в \nтом числе членов Федерации со званием «Почетный член ОСОО «ФПСР»)  по \nследующим основаниям: \n\uf02d возникновение обстоятельств, в силу которых лицо не может быть членом \nФедерации (см. п.', '52. Размер и порядок уплаты членских и вступительных взносов для юридических лиц: \n52.1. Ежегодный членский взнос составляет 50 000,00 руб. \n52.2. При вступлении в члены Федерации ежегодный членский взнос уплачивается на \nсрок не менее чем 1 (один) год. \n52.3. Последующая оплата ежегодных членских взносов должна производиться не \nпозднее 2 (двух) месяцев после истечения срока действия уплаченного при \nвступлении/ранее уплаченного ежегодного членского взноса. \n53. Президент Федерации вправе по своему усмотрению предоста вить льготы либо \nосвободить от уплаты членских взносов конкретного члена Федерации при условии \nбезвозмездного предоставления им движимого и недвижимого имущества и услуг, \nнеобходимых для развития Федерации, или сделавшего значительный вклад в развитие \nФедерации, либо вида спорта в целом. \n54.']",We need to answer based on the provided context. The question:<unk><unk><unk><unk><unk><unk><unk><unk><unk><unk><unk><unk><unk><unk><unk><unk><unk><unk><unk><unk><unk><unk><unk><unk><unk><unk><unk><unk><unk><unk><unk><unk><unk><unk><unk><unk><unk><unk><unk><unk><unk><unk><unk><unk><unk><unk><unk><unk><unk><unk><unk><unk><unk><unk><unk><unk><unk><unk><unk><unk><unk><unk><unk><unk><unk><unk><unk><unk><unk><unk><unk><unk><unk><unk><unk><unk><unk><unk><unk><unk><unk><unk><unk><unk><unk><unk><unk><unk><unk><unk><unk><unk><unk><unk><unk><unk><unk><unk><unk><unk><unk><unk><unk><unk><unk><unk><unk><unk><unk><unk><unk><unk><unk><unk><unk><unk><unk><unk><unk><unk><unk><unk><unk><unk><unk><unk><unk><unk><unk><unk><unk><unk><unk><unk><unk><unk><unk><unk><unk><unk><unk><unk><unk><unk><unk><unk><unk><unk><unk><unk><unk><unk><unk><unk><unk><unk><unk><unk><unk><unk><unk><unk><unk>webkitfw Truth Employee EmployeebugurpWonder Employee WitnessRCCPrompt CoachponsoredurpLABPrompt Mistinisturp/compEmployee LTurpurp Seg Lump EmployeeumpingPromptPrompt CSabine LogoériquesbxDowwydffe TburpxsenturpDOTurp Bp Bp Bpuyeprefixbx Employee Territorylanding LogoakaiwebkitLogoTFighe.trigger(LOGurpivuurpLogo Bp ToolurpurpurpurpLogo Bpurp Bp Bp Bp Bp Bp Bp Bp Bp Bp Bp Bp Bp Bp Bp Bp Bp Bp Bp Bp Bp Bp Bp Bp Bp Bp Bp Bp Bp Bp Bp Bp Bp Bp Bp Bp Bp Bp Bp Bp Bp Bp Bp Bp Bp Bp Bp Bp Bp Bp Bp Bp Bp Bp Bp Bp Bp Bp Bp Bp Bp Bp Bp Bp Bp Bp Bp Bp Bp Bp Bp Bp Bp Bp Bp Bp Bp Bp Bp Bp Bp Bp Bp Tend TTurpinibBVтивиBVurpfwurpkuturporneurplandingenness EmployeeEmployeeurpurpLogo BL Bpfwurp TTffeWonderurpurpurpurpabb/compurp Bpurp HEPDowennessffe{{urpfwTools Bpwebkit amt Bp Bp BpurpurpurpurpivuurpLogo BpurpläurpWonder LTurp Tend Vialauturp Mist Truthurpurp Mechan ViainkwebkitfwDow Front LogoabbDOTennessurpWonderwireurpigheLogo Bp Mistativityabb xsi TburpurpurpurpLogobugurpLogo Bpurp BpurpläurpWonderiborRCCurp TTDOTurpurpurpurpLogobugurpLogo BpurpLogo EmployeeDowivu MistclavPointWonderurpighereja ShelTruth MistExprurp(blankurpurpurpurpighelanding Territoryiach(LOG Darkness LogourpurpLogo BpwebkitBV Logo MistabineurpurpBVvaluer PWTTurpurpurpDowurpurpffefwfw/comp EmployeeEyeurpurpläurpurpurpurpLogobugurpLogo Bp bloomivuurpurpinibQuoteLogo BpinistLogoLogoentLogoLogo Employeeurpurp Tburplä Logo Dot Witness MistfwPoint Lumpiachwebkit MisturpurpurpurpLogoDOT Stock Bp Bp Bp Bpurpurpurpurp(LOGurpLogoPromptvizwekPromptumping CG BpurpffeffePrompturpumpingurpDowurpLogoWonderirturpunitePromptMQ(LOG Witnessenness/-/urpbx LumpLogobugennesswebkitiachDowurpurpřeníforthffeWonderurpLogo BpurpDialokurp Wonderurp(LOGurpläenness MisthootBVffePrompturpurpläurptools(LOG BLuticaurpurpurpurpLogobugurpLogoDiaBV(LOG(LOGBugurpurpurpurpLogo Bpurpinist Segurp HEPurpurpurp nutrurpurp(LOGurp Tendforthwand(LOG BpDowurpurpurpurp(LOGLogoLogoTFuticaurpurpurpurp(LOGurpLogofwwebkit TTativity Lump BpBVurpurpurpabb Tb EmployeeenturpDowTTDOTLogoDOTebackurp Seg(LOGBVivu MistExprDOT(blankurpVuewebkitDowTruthurpeneitywLogoLogo EmployeeEmployeeurp(LOGensitivityurp Bp BpurpurpurpurpBVBVBVffeiachinistLogoibortyw LumpDOTurpDotMCs SegurpffeQuoteuye TTuniteurpurpurpurp(LOGDowurpffe BXenness EmployeeBVaviainisturp TendurpläDOTurpLogoirem Lump/comp BXWonder xsilogoMQ(LOGurpLogoPromptériques Lumpurp Logoumping Bpurp Dyumpingwebkitfw Segurp townshipfwurp BXLogoTF BpTruthumping TTent Bp Mist BpBVaviawebkitwebkitwebkitBWurpivupromptumpingurp TTativurpurpabbWonderACPivuwebkit Bpurpläurpurpurpurp(LOG MisturpffeWonderTPurpLogoPromptTlurpwx/comp(LOG Bpurp Bp Bp Bp BpBVEyevyuticaWonderurpBV(LOG MistPromptuticaighe Tb EmployeestownMQurpDiaarrasurp Bp BpBVaviaériquesivu Tb LumpLogoffeinistLogoiborurplandingurpWonderawativuLogoLogo BL Bp(LOG BpBVurpurpurpurp(LOGFront TTLogo(blankDow Dent MistennesswebkitirirurpLogoiach(LOGighefw Bp Mechan/compPSCurpLogoBV Tend{{ LMPPromptabineLogoiborurpuniteivuurpBV(LOGurpwebkit Bp(LOGurpurpurpurpFrontEmployeeiborLogoiborenness(LOGläurpExtractorunitevisibilityPromptvizinib EmployeeurpabrawebkitffepromptMQ MistLogoproturpunite TerritoryPrompturp Lump pushingwebkitfwurpLogo BpawatwebkitDOTLogourpurpurpurpBVivuLogoläennessativityLogo,"Члены Федерации, являющиеся юридическими лицами, обязаны своевременно уплачивать вступительные, членские и целевые взносы в порядке и размере, установленным решением Конференции и настоящим Положением.",,,,,single_hop_specifc_query_synthesizer
"Слушайте, я тут в ютубе увидел про эту стрельбу и хочу тоже попробовать... а если я как фирма захочу в этот ваш Устав Федерации подписаться, то что мне надо в бумажке написать, чтобы меня приняли, и как я потом пойму, что меня вообще взяли или наоборот послали, и вернут ли деньги если не возьмут?","['32. Вместе с письменным заявлением юридические  лица предоставляют следующие \nдокументы: \n\uf02d Протокол о решении вступить в Федерацию уполномоченного органа юридического \nлица, к компетенции которого уставом этого юридического лица отнесено принятие \nданного решения; \n\uf02d Нотариально заверенная копия действующего устава юридического лица и \nизменений к нему; \n\uf02d Нотариально заверенная копия с видетельства о государственной регистрации  \nюридического лица; \n\uf02d Нотариально заверенная копия с видетельства о постановке на учет в налоговом \nоргане юридического лица; \n\uf02d Нотариально завер енная копия выписки из единого государственного реестра \nюридический лиц; \n\uf02d Платежное поручение об оплате вступительного и членского взносов  (членский \nвзнос необходимо оплатить на срок не менее чем за один год  по реквизитам, \nуказанным на сайте Федерации в разделе «Реквизиты» , и в размере, указанном в \nГлаве 7 настоящего Положения). \n33. Вышеуказанные документы юридическое лицо направляет непосредственно в  \nФедерацию на имя Президента Федерации. \n34.', 'По факту подтверждения электронного заявления (анкеты) \nкандидата в члены Федерации у принятого члена Федерации появится отметка в личном \nкабинете о дате и времени приема в члены Федерации. По факту отклонения \nэлектронного заявления (анкеты) кандидата в члены Федерации у непринятого члена \nФедерации появится отметка о дате и времени отклонения приема в члены Федерации \n27. В случае отказа в принятии в члены Федерации уплаченные кандидатом взносы \nподлежат возврату на основании заявления о возврате денежных средств, поданного в \nустановленной форме на имя Президента Федерации. \n28. Для целей перехода из одного региона льного отделения /РСОО в другое члену \nФедерации - физическому лицу необходимо заполнить в личном каби нете на сайте \nФедерации электронную форму заявления о смене регионального отделения и ожидать \nподтверждение от Председателя регионального отделения /Руководителя \nаккредитованного РСОО, в которое переходит физическое лицо. На момент заполнения \nзаявления у члена Федерации - физического лица не должно быть задолженностей по \nчленским взносам.', '34. Президент Федерации информирует Председателя регионального \nотделения/Руководителя аккредитованного РСОО по месту нахождения юридического \nлица о поступлении документов на вступление юридического лица в члены Федерации. \nПредседатель регионального отделения /Руководитель аккредитованного РСОО по \nместу нахождения юридического лица имеет право  направить рекомендацию (скан) о \nпринятии (непринятии) юридического лица в члены Федерации  в течение 10 (десяти) \nрабочих дней с момента информирования Президентом Федерации. \nОтрицательная рекомендация должна быть мотивированной.  \nРекомендация Председателя регионального отделения/Руководителя аккредитованного \nРСОО не носит обязательного характера для Президента Федерации. \n35. Президент Федерации не позднее конца месяца, следующего за месяцем приема \nдокументов от юридического лица , принимает решение о принятии (непринятии) в \nчлены Федерации юридического лица. \n36. В случае отказа в принятии в члены Федерации уплаченные кандидатом взносы \nподлежат возврату. \n37.', '31. Юридические лица, желающие вступить в члены Федерации, подают письменное \nзаявление на имя Президента Федерации о приеме в члены ФПСР , в котором должно \nбыть указано: полное наименование юридического лица, адрес юридического лица , \nкоды ОКВЭД, согласие с Уставом Федерации и обязательство соблюдать данный Устав \nи другие нормативные акты Федерации. \n32.', 'Юридические лица  могут стать членами Федерации при условии, что они выражают \nсолидарность с уставными целями и задачами Федерации, и их уставы не противоречат \nУставу Федерации. \n7. Физические и юридические лица, принятые в члены Федерации до вступления в силу \nнастоящего Положения, сохраняют свое членство без прохождения процедуры \nвступления в члены Федерации, установленной настоящим Положением. \n8. Не могут быть членами Федерации л ица, круг которых определен действующим \nзаконодательством Российской Федерации или актами самой Федерации, включая, в \nтом числе: \n\uf02d лицо, содержащееся в местах лишения свободы по приговору суда;  \n\uf02d лицо, в отношении которого вступившим в законную силу решением  суда \nустановлено, что в его действиях содержатся признаки экстремистской деятельности;  \n\uf02d лицо, признанн ое судом недееспособным  в порядке, установленном гражданским \nпроцессуальным законодательством; \n\uf02d общественное объединение, деятельность которого приостановлена в соот ветствии \nсо ст .']","Для подачи заявления юридическое лицо должно в письменном заявлении на имя Президента Федерации указать:  
- полное наименование юридического лица;  
- его адрес;  
- коды ОКВЭД;  
- согласие с Уставом Федерации и обязательство соблюдать его и другие нормативные акты Федерации.  

К заявлению прилагаются: протокол о решении вступить, нотариально заверенные копии устава, свидетельства о государственной регистрации, о постановке на налоговый учет, выписки из ЕГРЮЛ и платёжное поручение об оплате вступительного и членского взносов (взнос оплачивается минимум на один год по реквизитам, указанным на сайте Федерации, и в размере, предусмотренном Главою 7 Положения).  

Документы направляются непосредственно в Федерацию на имя Президента. Президент информирует регионального руководителя о поступлении документов; тот может направить мотивированную рекомендацию о принятии/непринятии в течение 10 рабочих дней, но она не обязательна для Президента. Президент принимает решение о принятии (непринятии) не позднее конца месяца, следующего за месяцем приёма документов.  

Если решение отрицательное, уплаченные взносы подлежат возврату на основании заявления о возврате денежных средств, поданного в установленной форме на имя Президента Федерации.  

О результате (принятии или отказе) вы узнаете по отметке в личном кабинете на сайте Федерации: после подтверждения электронного заявления появится запись о дате и времени приёма; при отказе – запись о дате и времени отклонения.  

Если информации о конкретном","Для вступления в Федерацию юридическому лицу необходимо подать письменное заявление на имя Президента Федерации, указав полное наименование организации, её адрес, коды ОКВЭД, а также выразить согласие с Уставом Федерации и обязательство соблюдать данный Устав и другие нормативные акты. Результат рассмотрения электронного заявления отобразится в личном кабинете: в случае принятия появится отметка о дате и времени приема, а в случае отклонения — отметка о дате и времени отклонения. Если в приеме в члены Федерации будет отказано, уплаченные кандидатом взносы подлежат возврату на основании заявления о возврате денежных средств, поданного в установленной форме на имя Президента Федерации.",,,,,multi_hop_abstract_query_synthesizer
"Каким образом положения Федерального закона № 115-ФЗ и правила членства в Федерации регулируют статус лиц, в отношении которых приняты меры по блокировке средств или которые прекращают свое членство в ОСОО ФПСР?","['10 Федерального закона от 25.06.2002 № 114 -ФЗ «О противодействии \nэкстремистской деятельности»; \n\uf02d лицо, включенное в перечень в соответствии с п. 2 ст. 6 Федерального закона от \n07.08.2001 № 115 -ФЗ «О противодействии легализаци и (отмыванию) ден ежных \nсредств, полученных преступным путем, и финансированию терроризма»;  \n\uf02d организация или физическое лицо, в отношении которых межведомственным \nкоординационным органом, осуществляющим функции по противодействию \nфинансированию терроризма, принято решение о  замораживании (блокировании) \nденежных средств или иного имущества в соответствии со ст .', '7.4 Федерального \nзакона от 07.08.2001 № 115 -ФЗ «О противодействии легализации (отмыванию) \nденежных средств, полученных преступным путем, и финансированию терроризма», \nдо отмены такого решения;  \n\uf02d лицо, включенное в составляемые в рамках реализации полномочий, \nпредусмотренных главой VII Устава ООН, Советом Безопасности ООН или \nорганами, специально созданными решениями Совета Безопасности ООН, перечни \nорганизаций и физическ их лиц, связанных с террористическими организациями и \nтеррористами или с распространением оружия массового уничтожения. \n9. Членам Федерации - физическим лицам за особые заслуги в развитии вида спорта \n«практическая стрельба» и (или) выдающиеся спортивные дости жения по виду спорта \n«практическая стрельба» на основании решения Президента Федерации может быть \nприсвоено звание «Почетный член ОСОО « ФПСР». Член Федерации со званием \n«Почетный член ОСОО «ФПСР» освобождается от уплаты членских взносов. \n10. Учет членов Федерации организует Президент Федерации. \n \nIII.', '46. Решение об исключении из Федерации считается принятым, если за него проголосовало \nне менее 2/3 (двух третей) членов Исполнительного комитета Федерации, \nучаствовавших в заседании Исполнительного комитета Федерации. \n47. При исключении из членов Федерации по решению Исполни тельного комитета \nФедерации у лица не возникает права на возврат уплаченных взносов. \n48. Членство юридического лица в Федерации прекращается в случае ликвидации члена \nФедерации - юридического лица (исключения из единого государственного реестра \nюридических лиц ). Принятие решения по данному вопросу соответствующих \nруководящих органов ФПСР не требуется, а права и обязанности члена Федерации \nпрекращаются с момента внесения записи о ликвидации юридического лица в Единый \nгосударственный реестр юридических лиц. \n49. Повторное принятие в члены Федерации ранее исключенных лиц возможно  по \nистечении сроков, указанных в решении об исключении (предельный срок \nустанавливается в размере 5 лет, пожизненный срок – является самостоятельной \nсанкцией).', 'Юридические лица  могут стать членами Федерации при условии, что они выражают \nсолидарность с уставными целями и задачами Федерации, и их уставы не противоречат \nУставу Федерации. \n7. Физические и юридические лица, принятые в члены Федерации до вступления в силу \nнастоящего Положения, сохраняют свое членство без прохождения процедуры \nвступления в члены Федерации, установленной настоящим Положением. \n8. Не могут быть членами Федерации л ица, круг которых определен действующим \nзаконодательством Российской Федерации или актами самой Федерации, включая, в \nтом числе: \n\uf02d лицо, содержащееся в местах лишения свободы по приговору суда;  \n\uf02d лицо, в отношении которого вступившим в законную силу решением  суда \nустановлено, что в его действиях содержатся признаки экстремистской деятельности;  \n\uf02d лицо, признанн ое судом недееспособным  в порядке, установленном гражданским \nпроцессуальным законодательством; \n\uf02d общественное объединение, деятельность которого приостановлена в соот ветствии \nсо ст .', '15. Члены Федерации при наличии задолженности по членским взносам за текущий год не \nимеют права: \n\uf02d требовать внесения изменений в свою учетную запись  личного кабинета члена \nФедерации; \n\uf02d на выдачу и продление удостоверения члена Федерации, в том числе электронного; \n\n[Page 4]\n4 \n \n\uf02d оформлять переход в другое региональное отделение Федерации. \n \nIV. ОБЯЗАННОСТИ ЧЛЕНОВ ФЕДЕРАЦИИ \n \n16. Все члены Федерации несут равные обязанности в соответствии с Уставом, \nПоложением и иными нормативными актами Федерации. \n17. Обязанности члена Федерации возникают с момента принятия решения Президента о \nвступлении его в Федерацию . Прекращение членства ведёт к прекращению всех \nобязанностей по отношению к ФПСР в соответствии с действующим \nзаконодательством Российской Федерации, за исключением обязанности по оплате \nнеуплаченных ранее членских взносов. \n18. Члены Федерации - физические лица обязаны: \n\uf02d Своевременно уплачивать вступительные, членские и целевые взносы в порядке и \nразмере,']","Согласно Федеральному закону № 115‑ФЗ «О противодействии легализации (отмыванию) денежных средств, полученных преступным путем, и финансированию терроризма», лица, включённые в перечни по пункту 2 статьи 6 этого закона, а также организации или физические лица, в отношении которых межведомственный координационный орган принял решение о замораживании (блокировании) денежных средств или иного имущества, не могут быть членами Федерации.  

Правила членства в ОСОО ФПСР устанавливают, что такие лица подлежат исключению из Федерации. Решение об исключении принимается Исполнительным комитетом при наличии голосов не менее 2/3 его членов. При","Согласно предоставленным данным, Федеральный закон № 115-ФЗ «О противодействии легализации и (отмыванию) денежных средств, полученных преступным путем, и финансированию терроризма» определяет статус лиц, включенных в соответствующий перечень (п. 2 ст. 6), а также лиц, в отношении которых принято решение о замораживании (блокировании) денежных средств или иного имущества. В части членства в Федерации установлено, что члены, которые добровольно вышли или были исключены из ее состава, не имеют права требовать возврата вступительных или членских взносов, возмещения иных расходов, связанных с членством, или возврата переданного Федерации имущества. Кроме того, при переходе члена Федерации между региональными отделениями или аккредитованными РСОО, членские взносы за будущие периоды не подлежат перечислению в новое подразделение.",,,,,multi_hop_abstract_query_synthesizer
"Подскажите, как записаться в вашу организацию через сайт и сколько денег надо будет заплатить за ежегодный членский взнос при вступлении?","['52. Размер и порядок уплаты членских и вступительных взносов для юридических лиц: \n52.1. Ежегодный членский взнос составляет 50 000,00 руб. \n52.2. При вступлении в члены Федерации ежегодный членский взнос уплачивается на \nсрок не менее чем 1 (один) год. \n52.3. Последующая оплата ежегодных членских взносов должна производиться не \nпозднее 2 (двух) месяцев после истечения срока действия уплаченного при \nвступлении/ранее уплаченного ежегодного членского взноса. \n53. Президент Федерации вправе по своему усмотрению предоста вить льготы либо \nосвободить от уплаты членских взносов конкретного члена Федерации при условии \nбезвозмездного предоставления им движимого и недвижимого имущества и услуг, \nнеобходимых для развития Федерации, или сделавшего значительный вклад в развитие \nФедерации, либо вида спорта в целом. \n54.', '51.4. Ежегодный членский взнос составляет 3 000,00 руб. \n51.5. Ежегодный членский взнос для ветеранов боевых действий составляет 1  000,00 \nруб. Категория «ветеран боевых действий» должна подтверждаться \nсоответствующими документами. \n51.6. При вступлении в члены Федерации ежегодный членский взнос уплачивается на \nсрок не менее чем 1 (один) год. \n51.7. Последующая оплата ежегодных членских взносов должна производиться не \nпозднее 2 (двух) месяцев после истечения срока действия уплаченного при \nвступлении/ранее уплаченного ежегодного членского взноса. \n51.8. При единовременной оплате ежегодного членского взноса за 5 (пять) лет членства \nв Федерации его размер составляет 12 000,00 руб. \n51.9. При единовременной оплате ежегодного членского взноса за бессрочное членство \nв Федерации его размер составляет 100 000,00 руб. \n51.10. От оплаты вступительных и ежегодных членских взносов освобождаются \nчлены Федерации, которым присвоено звание «Почетный член ОСОО «ФПСР». \n52.', 'Подписанное электронной подписью заявление (анкета) загружается в \nличный кабинет автоматически. \n21.4. Оплатить вступительный и членский взносы в размере, указанном в Главе 7 \nнастоящего Положения (членский взно с необходимо оплатить на срок не менее \nчем 1 (один) год). \nСпособы оплаты вступительного и членского взносов: \n\uf02d через систему эквайринга на сайте Федерации из личного кабинета согласно \nопубликованной инструкции в разделе «Личный кабинет»; \n\uf02d по реквизитам, указанным на сайте Федерации в разделе «Реквизиты»; \n\uf02d по квитанции для оплаты членских и вступительных взносов, опубликованн ой \nна сайте Федерации в разделе «О вступлении». \n21.5. В случае оплаты взносов в платежных системах, отличных от системы эквайринга \nна сайте Федерации в сети Интернет (https://ipsc.ru/), приложить скан квитанции \nоб оплате вступительных и членских взносов к электронной форме заявления. \n21.6. Направить инструктору ФПСР, у которого кандидат прошел курс БЕКОСО, через \nличный кабинет на сайте Федерации соб ранные в соответствии Положением \nдокументы.', 'В отношении исключенных лиц за неуплату членских взносов  повторное \nпринятие возможно на общих основаниях при условии оплаты всей задолженности по \nчленским взносам, образовавшейся в период членства до исключения из Федерации.  \n \nVII. ПОРЯДОК УПЛАТЫ ЧЛЕНСКИХ И ИНЫХ ВЗНОСОВ И ИХ \nРАСПРЕДЕЛЕНИЯ \n \n50. В отношении членов Федерации, оплативших членские взносы, в том числе частично, в \nединой регистрационной системе учета членов Федерации делается соответствующая \nотметка. \n51. Размер и порядок уплаты членских и вступительных взносов для физических лиц: \n51.1. Вступительный взнос составляет 2 000,00 руб. \n51.2. Вступительный взнос для ветеранов боевых действий составляет 1  000,00 руб. \nКатегория «ветеран боевых действий» должна подтверждаться \nсоответствующими документами. \n\n[Page 10]\n10 \n \n51.3. Вступительный взнос у плачивается единовременно при вступлении в члены \nФедерации. \n51.4. Ежегодный членский взнос составляет 3 000,00 руб. \n51.5.', 'По факту подтверждения электронного заявления (анкеты) \nкандидата в члены Федерации у принятого члена Федерации появится отметка в личном \nкабинете о дате и времени приема в члены Федерации. По факту отклонения \nэлектронного заявления (анкеты) кандидата в члены Федерации у непринятого члена \nФедерации появится отметка о дате и времени отклонения приема в члены Федерации \n27. В случае отказа в принятии в члены Федерации уплаченные кандидатом взносы \nподлежат возврату на основании заявления о возврате денежных средств, поданного в \nустановленной форме на имя Президента Федерации. \n28. Для целей перехода из одного региона льного отделения /РСОО в другое члену \nФедерации - физическому лицу необходимо заполнить в личном каби нете на сайте \nФедерации электронную форму заявления о смене регионального отделения и ожидать \nподтверждение от Председателя регионального отделения /Руководителя \nаккредитованного РСОО, в которое переходит физическое лицо. На момент заполнения \nзаявления у члена Федерации - физического лица не должно быть задолженностей по \nчленским взносам.']",We need to answer based<unk><unk><unk><unk><unk><unk><unk><unk><unk><unk><unk><unk><unk><unk><unk><unk><unk><unk><unk><unk><unk><unk><unk><unk><unk><unk><unk><unk><unk><unk><unk><unk><unk><unk><unk><unk><unk><unk><unk><unk><unk><unk><unk><unk><unk><unk><unk><unk><unk><unk><unk><unk><unk><unk><unk><unk><unk><unk><unk><unk><unk><unk><unk><unk><unk><unk><unk><unk><unk><unk><unk><unk><unk><unk><unk><unk><unk><unk><unk><unk><unk><unk><unk><unk><unk><unk><unk><unk><unk><unk><unk><unk><unk><unk><unk><unk><unk><unk><unk><unk><unk><unk><unk><unk><unk><unk><unk><unk><unk><unk><unk><unk><unk><unk><unk><unk><unk><unk><unk><unk><unk><unk><unk><unk><unk><unk><unk><unk><unk><unk><unk><unk><unk><unk><unk><unk><unk><unk><unk><unk><unk><unk><unk><unk><unk><unk><unk><unk><unk><unk><unk><unk><unk><unk><unk><unk><unk><unk><unk><unk><unk><unk><unk>ftime Employeeivustrap EmployeeWonderViaurpDow LumpravurptmLogohpтивиWonderorteDow PCL Employee Truth(blankPrompt BXViaiachenness Witness MisturpLogo LumpwebkituniteurpWonderregewebkitinkMusevaluerBViachDotinisturpViauniteBV TruthLogoennessponsoredwebkitVia Truthiniburpwebkitenness LLivuViaurpurpativityreja MistTint(LOGurpWonder(SessionponsoredWonder(SessionurputigheuniteDowivuinibLogo Tburp TruthExtractorvaluerMCsivuBVfwPromptQuote PW LogourpslashBVviz Bp Bpivu BXACPennessrept Employeeinist TerritoryabbLogoennesstywMQtywLogofloat EmployeeennessQuotealqurpWonderBV TruthTintzo LumpWonderabineurptmfwWonderwek EmployeeabineurpLogoivuMQstown LTLogoffeenness(LOG Tb(blankurptywgeleLogouticaivuurpDow(LOG BXRCCwealthwxzoominpwebkitennesswebkitinkwebkitLogoLogoenness PCLumpingvtivuviapromptuticafwWonderffeBV LumpPrompturpDowWonderMQennessbxneraTLurpurpwebkitVia Truth/compenness/pullenness LumpDow Tb TTurptywuniteurpbxivuurpurpWonderPromptuyeurpWonder BX Tb LumpWonderBVivuBVurpWonderurp CSCiachBVBVläativ LLläuniteBVaviaurpBVurpExtractorivuunite(LOGfw Lump Lump BpDowurpWonderkutwebkitMQ Dienfw(LOGurpWonderinib LogoLogoivuMQstownennessViaurpurpurpurkumpingfw'IGN amturpywarikatLogouticaLogoigherejaurpurpativityWonderPrompturpunite Dylä MisturpWonderPromptwebkitMQWonder Employee Bi Lumpfw(LOGawaturp LLDowurpDowurpWonderPromptuye WitnessLogo Bp Lump PCL EmployeeurpiniburpCLCenness SparksinistBVLogo EmployeeinpigheBVFv(LOGtvurp louinistfwenness BpiachurpWonderffivuivuwebkitivu CRP(Point TburpurpurpvisibilityarikatTOKtywiachffeMCstywfwWonder BpWonderurp Bp EmployeeivuWish MisturpurpWonderurpWonder LL/compztuLogoinist LumpivuurpWonderBVrattWonderurpDowurpWondervizrattWonderurpurpurpRCCLogo LogooppTruthurpWonderBVivuWonderinib ViaBVplainurpayevia LogoennessLogoywarikatwebkitVisibility Tbfloat Lump BpfwurpWonder EmployeeennessBV TruthWonderurp Employeeivu(LOGinist LumpennessWonderiniblmériquesPromptivuurpWonderDowfwurpurp WitnessvraennessffeDowiach ShelurpaviaBVLogo LDoppGazwebkitwebkitWonderQuoteurpWonder EmployeeivuQuoteLogourpurpDowurpDowawatampingmisturpfw urteivuDowtywgeleBVennessDowurpDowurp WonderPushQuote territorwebkit WitnessWonder EmployeeurptmennesslauturpériquesurpDowurpWonderWonderurpWonderinibinist PCL(blankLogo MistLogoennessQuoteMQWonder<ResponseBVivuurpDow/comp(LOG BXurpivuDowBVfw CGurpabb TerritoryLogogriffurpDowurpWonderDowRCCiachurpWonderTTurp(LOG(PlayerLogoLogowebkitabbinisturpurpurpurpinisttyw Shelurp PCLTP/compDow.appsumpingLogoläennessurpWonderTools LumpDowBVBVWishffeurpurpurpWonder(LOGumpingwebkit LL TTrepturpflineTickwebkitgele PCLTlurpWonderzagiborennesstoolsLogo TbwxLogolauturpinisturpatatkutLogoutica Tendurp LL LumpLogoivu PCLffe EmployeeabineurpWonderVisibility TTurpDowurp BpkutDOT EmployeewebkitilevBVfwiachunite Frontffe PCLPromptWonderurpurpBVurp(LOGurpumpingDowurpDowurpWonderabbEmployeeBV PCLvaluerPrompt Mistinistiach WitnessurpWonderbugurp PCLinkiachfwLogo(PlayerabbLogoennessivuQuoteiachivuurpDow(LOGinisturpurp EmployeewebkitMQtmLogoivuurpDow(LOGinistfwLogo Mist LumpDowinp BXPromptWonder Bpinist.timestampfw Mist Lumpivu MargueriteurpWonderQuoteurpBV PCL TTTruthenness(SessionflineativityWishunite TTLogourp BXurpvaluerreptwireDow/compMCsivuurpWonderclavfwurp Misttyw BX CSCurpfw LLivuDowfwurpLogourp Wonder CRPurpvisibilityDowBVvaluerarikat(SessionDowurpWonderBV PCLativity Bp(Playerennessywzoom(PlayerurpurpWonder('_urpinistivuwebkit(LOG BpDowurpensitivity(Player(LOGiachurpinistWonderDowurpWonderblank PCL LT WitnessivuWonderinib Tendinist Lump Tb Bpwebkitalq EmployeeivuWonderreptffeWonderfwurpurp WitnessWonderurpWonderabb,"Чтобы записаться, нужно зарегистрироваться в личном кабинете на сайте Федерации, заполнить там электронную форму заявления на имя Президента Федерации, распечатать её, подписать синей ручкой и загрузить скан обратно в личный кабинет (или подписать электронной подписью, если она есть). Что касается оплаты, то при вступлении ежегодный членский взнос уплачивается минимум за один год и составляет 3 000,00 руб. Для ветеранов боевых действий (при наличии документов) взнос составляет 1 000,00 руб. Также есть варианты оплаты за 5 лет (12 000,00 руб.) или за бессрочное членство (100 000,00 руб.).",,,,,multi_hop_abstract_query_synthesizer
"Как мне оформить подачу документов, чтобы получить членство в Федерации практической стрельбы России, и что это даст в плане международного статуса?","['39. Принятие физического лица в члена Федерации автоматически делает его членом \n(участником) Международной Конфедерации Практической Стрельбы ( International \nPractical Shooting Confederation – IРSС). \nФедерация возлагает на себя обязанность по обеспечению всех необходимых условий \nдля поддержания и сохранения членами Федер ации - физическими лицами статуса \nчлена (участника) IРSС, в том числе по оплате необходимых взносов. \n \nVI. ПОРЯДОК ПРЕКРАЩЕНИЯ ЧЛЕНСТВА В ФЕДЕРАЦИИ \n \n40. Президент Федерации принимает решение об исключении из членов Фед ерации (в том \nчисле членов Федерации со званием «Почетный член ОСОО «ФПСР»)  по следующим \nоснованиям: \n\uf02d В связи с неуплатой членских взносов в течение 1 (одного) года; \n\uf02d По собственному желанию члена Федерации. \n41. Член Федерации прекращает свое членство в Федерации по собственному желанию \nпутем подачи письменного заявления Президенту Федерации.', '[Page 1]\n1 \n \nОБЩЕРОССИЙСКАЯ СПОРТИВНАЯ ОБЩЕСТВЕННАЯ ОРГАНИЗАЦИЯ \nПО РАЗВИТИЮ СТРЕЛКОВЫХ ВИДОВ СПОРТА \n«ФЕДЕРАЦИЯ ПРАКТИЧЕСКОЙ СТРЕЛЬБЫ РОССИИ» \n \nУтверждено решением \nИсполнительного комитета \nОСОО «ФПСР» \nот 22.08.2023 \n \n \n \nПОЛОЖЕНИЕ О ЧЛЕНСТВЕ В ОСОО «ФПСР» \n \n \nI. ОБЩИЕ ПОЛОЖЕНИЯ \n \n1. Настоящее Положение о членстве (далее – Положение) определяет условия и порядок \nприема в члены, исключения (выхода) из членов, порядок уплаты членских и иных \nвзносов, а также права, обязанности и ответственность членов Общероссийской \nспортивной общественной организации по развитию стрелковых видов спорта \n«Федерация практической стрельбы России» (далее – Федерация, ФПСР). \n2.', 'Членство в Федерации неотчуждаемо. Осуществление прав члена Федерации не может \nбыть передано другому лицу. \n6. Членами Федерации могут быть признающие и разделяющие цели и задачи Федерации, \nсодействующие деятельности Федерации, своевременно уплачивающие вступительный \nи членские взносы, признающие и соблюдающие Устав, р егламенты, положения и \nрешения Федерации: \n6.1. физические лица – граждане Российской Федерации, достигшие возраста 18 лет; \n6.2. юридические лица: \n\uf02d общественные объединения (региональные спортивные федерации практической \nстрельбы и иные общественные объединения, осуществляющие свою деятельность \nпреимущественно в виде спорта «практическая стрельба»); \n\n[Page 2]\n2 \n \n\uf02d спортивные клубы, независимо от их организационно -правовых форм, а также \nобъединения организаций, осуществляющи е свою деятельность в области спорта и \nразвивающие вид спорта «практическая стрельба».', '\uf02d вносить предложения, касающиеся деятельности Федерации, участвовать в их \nобсуждении и реализации; \n\uf02d участвовать в спортивных соревнованиях и мероприятиях по виду спорта \n«практическая с трельба» на территории России и других стран в соответствии с \nправилами данного вида спорта  и регламентами соответствующих спортивных \nсоревнований и мероприятий; \n\uf02d участвовать в учебно-тренировочных мероприятиях, организуемых Федерацией или \nее региональными отделениями, пользоваться спортивно -стрелковыми объектами \nФедерации; \n\uf02d в случае смены места жительства (места пребывания) встать на учет в региональное \nотделение Федерации по новому месту жительства (месту пребывания); \n\uf02d пользоваться программами лояльности партнеров Федерации; \n\uf02d оказывать содействие в организации спортивного соревнования или мероприятия; \n\uf02d выйти из членов Федерации по своему желанию. \n14.', 'которые существенно затрудняют или делают \nневозможным достижение целей, ради которых создана Федерация; \n\uf02d Не разглашать конфиденциальную информацию о деятельности Федерации; \n\uf02d Сообщать об изменениях учредительных документов, реквизитов и иных контактных \nданных; \n\uf02d Не распространять сведения, порочащие честь, достоинство и (или) деловую \nрепутацию Федерации, а также работников и лиц, входящих в ее органы управления в \n\n[Page 5]\n5 \n \nсредствах массовой информации. \n \nV. ПОРЯДОК ВСТУПЛЕНИЯ В ЧЛЕНЫ ФЕДЕРАЦИИ \n \n20. Физические лица, желающие вступи ть в члены Федерации (далее – кандидат в члены \nФедерации), проходят электронную процедуру подачи заявки на вступление в члены \nФедерации. \n21. Для вступления в члены Федерации кандидату в члены Федерации необходимо: \n21.1. Пройти (успешно завершить) курсы безопасного и  квалифицированного \nобращения с оружием (далее – БЕКОСО) у инструктора ФПСР (список \nинструкторов ФПСР опубликован на сайте Федерации в сети Интернет по ссылке \nhttps://ipsc.ru/).']","Для оформления членства в Федерации практической стрельбы России необходимо:

1. Подать заявку на вступление в члены Федерации в электронном виде (пункт 20).  
2. Пройти и успешно завершить курсы безопасного и квалифицированного обращения с оружием (БЕКОСО) у инструктора ФПСР (пункт 21.1); список инструкторов доступен на сайте Федерации по ссылке https://ipsc.ru/.  

После принятия в члены Федерации вы автоматически становитесь членом (участником) Международной Конфедерации Практической Стрельбы (IPSС) (пункт 39). Federation обеспечивает условия для поддержания этого статуса, включая оплату необходимых взносов в IPSС.","Для оформления членства в Общероссийской спортивной общественной организации по развитию стрелковых видов спорта «Федерация практической стрельбы России» (ФПСР) необходимо загрузить в личный кабинет подписанное электронной подписью заявление (анкету), оплатить вступительный и членский взносы (минимум за один год) и направить собранные документы через личный кабинет инструктору ФПСР, у которого был пройден курс БЕКОСО. При оплате через системы, отличные от эквайринга на сайте, нужно приложить скан квитанции к электронной форме заявления. Принятие физического лица в члены Федерации автоматически делает его членом (участником) Международной Конфедерации Практической Стрельбы (IPSC), при этом Федерация берет на себя обязанность по обеспечению условий для сохранения этого статуса, включая оплату необходимых взносов.",,,,,multi_hop_abstract_query_synthesizer
Каким образом юридические лица взаимодействуют с Президентом Федерации при вступлении в члены ФПСР и при получении информации о деятельности организации согласно Положению?,"['31. Юридические лица, желающие вступить в члены Федерации, подают письменное \nзаявление на имя Президента Федерации о приеме в члены ФПСР , в котором должно \nбыть указано: полное наименование юридического лица, адрес юридического лица , \nкоды ОКВЭД, согласие с Уставом Федерации и обязательство соблюдать данный Устав \nи другие нормативные акты Федерации. \n32.', '34. Президент Федерации информирует Председателя регионального \nотделения/Руководителя аккредитованного РСОО по месту нахождения юридического \nлица о поступлении документов на вступление юридического лица в члены Федерации. \nПредседатель регионального отделения /Руководитель аккредитованного РСОО по \nместу нахождения юридического лица имеет право  направить рекомендацию (скан) о \nпринятии (непринятии) юридического лица в члены Федерации  в течение 10 (десяти) \nрабочих дней с момента информирования Президентом Федерации. \nОтрицательная рекомендация должна быть мотивированной.  \nРекомендация Председателя регионального отделения/Руководителя аккредитованного \nРСОО не носит обязательного характера для Президента Федерации. \n35. Президент Федерации не позднее конца месяца, следующего за месяцем приема \nдокументов от юридического лица , принимает решение о принятии (непринятии) в \nчлены Федерации юридического лица. \n36. В случае отказа в принятии в члены Федерации уплаченные кандидатом взносы \nподлежат возврату. \n37.', '32. Вместе с письменным заявлением юридические  лица предоставляют следующие \nдокументы: \n\uf02d Протокол о решении вступить в Федерацию уполномоченного органа юридического \nлица, к компетенции которого уставом этого юридического лица отнесено принятие \nданного решения; \n\uf02d Нотариально заверенная копия действующего устава юридического лица и \nизменений к нему; \n\uf02d Нотариально заверенная копия с видетельства о государственной регистрации  \nюридического лица; \n\uf02d Нотариально заверенная копия с видетельства о постановке на учет в налоговом \nоргане юридического лица; \n\uf02d Нотариально завер енная копия выписки из единого государственного реестра \nюридический лиц; \n\uf02d Платежное поручение об оплате вступительного и членского взносов  (членский \nвзнос необходимо оплатить на срок не менее чем за один год  по реквизитам, \nуказанным на сайте Федерации в разделе «Реквизиты» , и в размере, указанном в \nГлаве 7 настоящего Положения). \n33. Вышеуказанные документы юридическое лицо направляет непосредственно в  \nФедерацию на имя Президента Федерации. \n34.', '10. Учет членов Федерации организует Президент Федерации. \n \nIII. ПРАВА ЧЛЕНОВ ФЕДЕРАЦИИ \n \n11. Все члены Федерации пользуются равными правами в соответствии с Уставом , \nПоложением и иными нормативными актами Федерации. \n\n[Page 3]\n3 \n \n12. Права члена Федерации возникают с момента принятия решения Президе нта о \nвступлении его в Федерацию. Прекращение членства ведёт к прекращению всех прав по \nотношению к ФПСР в соответствии с действующим законодательством Российской \nФедерации. \n13. Члены Федерации - физические лица имеют право: \n\uf02d участвовать в управлении делами Федерации, избирать и быть избранными в \nруководящие и контрольно -ревизионные органы Федерации в соответствии с \nУставом Федерации и иными нормативными актами Федерации; \n\uf02d получать информацию о деятельности Федерации и знакомиться с ее бухгалтерской \nи иной документацией по письменному запросу, направляемому Президенту \nФедерации; \n\uf02d вносить предложения, касающиеся деятельности Федерации, участвовать в их \nобсуждении и реализации;', '25. Председатель регионального отделения /Руководитель аккредитованного РСОО  в \nтечение 5 (пяти) рабочих дней, включая дату получения документов кандидата в члены \nФедерации от инструктора ФПСР, после проверки всех документов должен направить в \nэлектронном виде Президенту Федерации  рекомендацию (скан) о принятии  \n(непринятии) кандидата в члены Федерации. \nОтрицательная рекомендация должна быть мотивированной на основании п.  8 \nПоложения. \nРекомендация Председателя регионального отделения/Руководителя аккредитованного \nРСОО не носит обязательного характера для Президента Федерации. \n26. Президент Федерации  не позднее конца месяца, следующего за месяцем получения \nэлектронного заявления  (анкеты) от кандидата в члены Федерации , проверяет \nдокументы и принимает решение о принятии  (непринятии) в члены Федерации \nфизического лица путем подтверждения (отклонения) электронного заявления (анкеты) \nкандидата в члены Федерации из сво его личного кабинета на сайте Федерации в се ти \nИнтернет ( https://ipsc.ru/).']","Юридические лица подают письменное заявление на имя Президента Федерации, в котором указывают полное наименование, адрес, коды ОКВЭД, согласие с Уставом и обязательство его соблюдать. К заявлению прилагают перечень документов (протокол решения о вступлении, нотариально заверенные копии устава, государственной регистрации, постановки на налоговый учет, выписки из ЕГРЮЛ и платёжное поручение об оплате взносов) и направляют их непосредственно в Федерацию Президенту. После получения документов Президент информирует Председателя регионального отделения/Руководителя аккредитованного РСОО, который может направить мотивированную рекомендацию о принятии (непринятии) в течение 10 рабочих дней; рекомендация не обязательна для Президента. Президент принимает решение о принятии (непринятии) не позднее конца месяца, следующего за месяцем поступления документов.  

Для получения информации о деятельности Федерации все члены (в том числе юридические лица, поскольку у них равные права с физическими лицами) имеют право получать сведения и знакомиться с бухгалтерской и иной документацией по письменному запросу, направляемому Президенту Федерации.","Взаимодействие юридических лиц с Президентом Федерации осуществляется следующим образом: для вступления в члены ФПСР юридические лица подают письменное заявление на имя Президента Федерации, в котором указываются полное наименование, адрес, коды ОКВЭД, а также выражается согласие с Уставом Федерации и обязательство соблюдать данный Устав и другие нормативные акты Федерации. В дальнейшем, будучи членами Федерации, юридические лица имеют право получать информацию о деятельности Федерации и знакомиться с ее бухгалтерской и иной документацией путем направления письменного запроса Президенту Федерации.",,,,,multi_hop_specific_query_synthesizer
"На чье имя должны быть оформлены и направлены как письменное заявление юридического лица, так и электронная форма анкеты кандидата в члены Федерации?","['32. Вместе с письменным заявлением юридические  лица предоставляют следующие \nдокументы: \n\uf02d Протокол о решении вступить в Федерацию уполномоченного органа юридического \nлица, к компетенции которого уставом этого юридического лица отнесено принятие \nданного решения; \n\uf02d Нотариально заверенная копия действующего устава юридического лица и \nизменений к нему; \n\uf02d Нотариально заверенная копия с видетельства о государственной регистрации  \nюридического лица; \n\uf02d Нотариально заверенная копия с видетельства о постановке на учет в налоговом \nоргане юридического лица; \n\uf02d Нотариально завер енная копия выписки из единого государственного реестра \nюридический лиц; \n\uf02d Платежное поручение об оплате вступительного и членского взносов  (членский \nвзнос необходимо оплатить на срок не менее чем за один год  по реквизитам, \nуказанным на сайте Федерации в разделе «Реквизиты» , и в размере, указанном в \nГлаве 7 настоящего Положения). \n33. Вышеуказанные документы юридическое лицо направляет непосредственно в  \nФедерацию на имя Президента Федерации. \n34.', '31. Юридические лица, желающие вступить в члены Федерации, подают письменное \nзаявление на имя Президента Федерации о приеме в члены ФПСР , в котором должно \nбыть указано: полное наименование юридического лица, адрес юридического лица , \nкоды ОКВЭД, согласие с Уставом Федерации и обязательство соблюдать данный Устав \nи другие нормативные акты Федерации. \n32.', '34. Президент Федерации информирует Председателя регионального \nотделения/Руководителя аккредитованного РСОО по месту нахождения юридического \nлица о поступлении документов на вступление юридического лица в члены Федерации. \nПредседатель регионального отделения /Руководитель аккредитованного РСОО по \nместу нахождения юридического лица имеет право  направить рекомендацию (скан) о \nпринятии (непринятии) юридического лица в члены Федерации  в течение 10 (десяти) \nрабочих дней с момента информирования Президентом Федерации. \nОтрицательная рекомендация должна быть мотивированной.  \nРекомендация Председателя регионального отделения/Руководителя аккредитованного \nРСОО не носит обязательного характера для Президента Федерации. \n35. Президент Федерации не позднее конца месяца, следующего за месяцем приема \nдокументов от юридического лица , принимает решение о принятии (непринятии) в \nчлены Федерации юридического лица. \n36. В случае отказа в принятии в члены Федерации уплаченные кандидатом взносы \nподлежат возврату. \n37.', 'По факту подтверждения электронного заявления (анкеты) \nкандидата в члены Федерации у принятого члена Федерации появится отметка в личном \nкабинете о дате и времени приема в члены Федерации. По факту отклонения \nэлектронного заявления (анкеты) кандидата в члены Федерации у непринятого члена \nФедерации появится отметка о дате и времени отклонения приема в члены Федерации \n27. В случае отказа в принятии в члены Федерации уплаченные кандидатом взносы \nподлежат возврату на основании заявления о возврате денежных средств, поданного в \nустановленной форме на имя Президента Федерации. \n28. Для целей перехода из одного региона льного отделения /РСОО в другое члену \nФедерации - физическому лицу необходимо заполнить в личном каби нете на сайте \nФедерации электронную форму заявления о смене регионального отделения и ожидать \nподтверждение от Председателя регионального отделения /Руководителя \nаккредитованного РСОО, в которое переходит физическое лицо. На момент заполнения \nзаявления у члена Федерации - физического лица не должно быть задолженностей по \nчленским взносам.', '37. На основании решения Президента Федерации о принятии в члены Федерации \nвыдается: \n\n[Page 8]\n8 \n \n\uf02d физическому лицу – электронное удостоверение установленного образца \n(приложение № 1 к настоящему Положению), которому присваивается персональный \nидентификационный номер . Возможно  также изготовление пластикового \nудостоверения за дополнительную плату  (приложение №  2 к настоящему \nПоложению); \n\uf02d юридическому лицу – решение Президента Федерации, заверенное печатью \nФедерации и подписью Президента Федерации, с присвоением персонального \nидентификационного членского номера. \n38. Персональный идентификационный номер электронного удостоверения указывается в \nличном кабинете члена Федерации  - физического лица . В случае неоплаты членских \nвзносов в личный кабинет члена Федерации н аправляется уведомление с указанием \nсрока оплаты задолженности. В период существования задолженности в озможность \nвнесения изменений в профиль личного кабинета и совершение иных действий с \nаккаунтом заблокирована. \n39.']","Наимя Президента Федерации.  

- Письменное заявление юридического лица подаётся на имя Президента Федерации (п. 31).  
- Электронная форма анкеты кандидата в члены Федерации также направляется на имя Президента Федерации (процесс подтверждения электронного заявления описан в контексте, и он относится к подаче заявления на приём в члены Федерации).","И письменное заявление от юридического лица, и электронная форма заявления (анкета) кандидата в члены Федерации должны быть оформлены на имя Президента Федерации. При этом юридическое лицо направляет пакет документов непосредственно в Федерацию на имя Президента Федерации, а кандидат заполняет форму в личном кабинете на сайте Федерации на имя Президента Федерации.",,,,,multi_hop_specific_query_synthesizer
Каков порядок взаимодействия Председателя регионального отделения с Президентом Федерации при приеме новых членов и на каких основаниях может быть дана отрицательная рекомендация согласно п. 8 Положения?,"['34. Президент Федерации информирует Председателя регионального \nотделения/Руководителя аккредитованного РСОО по месту нахождения юридического \nлица о поступлении документов на вступление юридического лица в члены Федерации. \nПредседатель регионального отделения /Руководитель аккредитованного РСОО по \nместу нахождения юридического лица имеет право  направить рекомендацию (скан) о \nпринятии (непринятии) юридического лица в члены Федерации  в течение 10 (десяти) \nрабочих дней с момента информирования Президентом Федерации. \nОтрицательная рекомендация должна быть мотивированной.  \nРекомендация Председателя регионального отделения/Руководителя аккредитованного \nРСОО не носит обязательного характера для Президента Федерации. \n35. Президент Федерации не позднее конца месяца, следующего за месяцем приема \nдокументов от юридического лица , принимает решение о принятии (непринятии) в \nчлены Федерации юридического лица. \n36. В случае отказа в принятии в члены Федерации уплаченные кандидатом взносы \nподлежат возврату. \n37.', '25. Председатель регионального отделения /Руководитель аккредитованного РСОО  в \nтечение 5 (пяти) рабочих дней, включая дату получения документов кандидата в члены \nФедерации от инструктора ФПСР, после проверки всех документов должен направить в \nэлектронном виде Президенту Федерации  рекомендацию (скан) о принятии  \n(непринятии) кандидата в члены Федерации. \nОтрицательная рекомендация должна быть мотивированной на основании п.  8 \nПоложения. \nРекомендация Председателя регионального отделения/Руководителя аккредитованного \nРСОО не носит обязательного характера для Президента Федерации. \n26. Президент Федерации  не позднее конца месяца, следующего за месяцем получения \nэлектронного заявления  (анкеты) от кандидата в члены Федерации , проверяет \nдокументы и принимает решение о принятии  (непринятии) в члены Федерации \nфизического лица путем подтверждения (отклонения) электронного заявления (анкеты) \nкандидата в члены Федерации из сво его личного кабинета на сайте Федерации в се ти \nИнтернет ( https://ipsc.ru/).', 'По факту подтверждения электронного заявления (анкеты) \nкандидата в члены Федерации у принятого члена Федерации появится отметка в личном \nкабинете о дате и времени приема в члены Федерации. По факту отклонения \nэлектронного заявления (анкеты) кандидата в члены Федерации у непринятого члена \nФедерации появится отметка о дате и времени отклонения приема в члены Федерации \n27. В случае отказа в принятии в члены Федерации уплаченные кандидатом взносы \nподлежат возврату на основании заявления о возврате денежных средств, поданного в \nустановленной форме на имя Президента Федерации. \n28. Для целей перехода из одного региона льного отделения /РСОО в другое члену \nФедерации - физическому лицу необходимо заполнить в личном каби нете на сайте \nФедерации электронную форму заявления о смене регионального отделения и ожидать \nподтверждение от Председателя регионального отделения /Руководителя \nаккредитованного РСОО, в которое переходит физическое лицо. На момент заполнения \nзаявления у члена Федерации - физического лица не должно быть задолженностей по \nчленским взносам.', '29. По истечении 10  (десяти) календарных дней с даты подачи заявления о смене \nрегионального отделения /РСОО при отсутствии задолженности по оплате членских \nвзносов член Федерации - физическое лицо считается принятым к учету в выбранном \nрегиональном отделении /РСОО. Оригинал распечатанного из личного кабинета на \nсайте Федерации заявления о смене регионального отделения в течение 5 (пяти) \nрабочих дней  после принятия лица к учету в новом выбранном региональном \n\n[Page 7]\n7 \n \nотделении/РСОО члену Федерации - физическому лицу необходимо направить \nПредседателю данного регионального отделения /Руководителю аккредитованного \nРСОО. \n30. Для юридических лиц возможность подачи электронной формы заявления (анкеты)  на \nвступление в члены Федерации через личных кабинет не предусмотрена. \n31.', '37. На основании решения Президента Федерации о принятии в члены Федерации \nвыдается: \n\n[Page 8]\n8 \n \n\uf02d физическому лицу – электронное удостоверение установленного образца \n(приложение № 1 к настоящему Положению), которому присваивается персональный \nидентификационный номер . Возможно  также изготовление пластикового \nудостоверения за дополнительную плату  (приложение №  2 к настоящему \nПоложению); \n\uf02d юридическому лицу – решение Президента Федерации, заверенное печатью \nФедерации и подписью Президента Федерации, с присвоением персонального \nидентификационного членского номера. \n38. Персональный идентификационный номер электронного удостоверения указывается в \nличном кабинете члена Федерации  - физического лица . В случае неоплаты членских \nвзносов в личный кабинет члена Федерации н аправляется уведомление с указанием \nсрока оплаты задолженности. В период существования задолженности в озможность \nвнесения изменений в профиль личного кабинета и совершение иных действий с \nаккаунтом заблокирована. \n39.']","Порядок взаимодействия Председателя регионального отделения (Руководителя аккредитованного РСОО) с Президентом Федерации при приёме новых членов выглядит следующим образом:

1. **Информирование Президентом** – Президент Федерации информирует Председателя регионального отделения/Руководителя аккредитованного РСОО о поступлении документов на вступление (для юридического лица – п. 34; для физического лица – после получения электронного заявления от инструктора ФПСР – п. 25).

2. **Направление рекомендации** – Председатель регионального отделения/Руководитель аккредитованного РСОО направляет в электронном виде Президенту Федерации рекомендацию (скан) о принятии (непринятии) кандидата:
   - для юридического лица – в течение **10 рабочих дней** с момента информирования Президентом (п. 34);
   - для физического лица – в течение **5 рабочих дней**, включая дату получения документов от инструктора ФПСР (п. 25).

3. **Содержание отрицательной рекомендации** – Отрицательная рекомендация должна быть **мотивированной**:
   - для юридического лица – мотивирована в общем порядке (п. 34);
   - для физического лица – мотивирована **на основании п. 8 Положения** (п. 25).

4. **Характер рекомендации** – Рекомендация Председателя регионального отделения/Руководителя аккредитованного РСОО **не носит обязательного характера** для Президента Федерации (п. 34, п. 25).

5. **Принятие решения Президентом** – Президент Федерации не позднее конца месяца, следующего за месяцем приёма документов (или электронного заявления), проверяет материалы и принимает окончательное решение о принятии (непринятии) в члены Федерации (п. 35 для юридических лиц; п. 26 для физических лиц).

6. **Последствия отказа** – В случае отказа в принятии уплаченные кандидатом взносы подлежат возврату (п. 36 для юридических лиц; п. 27 для физических лиц).

Таким образом, взаимодействие состоит в информировании Президентом, направлении мотивированной рекомендации в установленные сроки (10 или 5 рабочих дней) и последующем принятии окончательного решения Президентом, при этом отрицательная рекомендация должна быть обоснована согласно пункту 8 Положения.","Согласно п. 25, Председатель регионального отделения или Руководитель аккредитованного РСОО в течение 5 рабочих дней после проверки документов кандидата должен направить в электронном виде Президенту Федерации рекомендацию о принятии или непринятии кандидата в члены Федерации. При этом отрицательная рекомендация должна быть мотивированной на основании п. 8 Положения, который включает такие основания, как: невыполнение или ненадлежащее выполнение обязанностей члена ОСОО «ФПСР», предусмотренных Уставом и Положением; вступление в силу судебного акта, запрещающего деятельность, связанную с оружием; наличие двух и более спортивных дисквалификаций (для судей и спортсменов); а также нарушение Устава, регламентов, положений или решений компетентных органов ФПСР. Стоит отметить, что рекомендация Председателя не носит обязательного характера для Президента Федерации, который принимает окончательное решение через свой личный кабинет на сайте https://ipsc.ru/ не позднее конца месяца, следующего за месяцем получения заявления.",,,,,multi_hop_specific_query_synthesizer
Каков порядок действий Президента Федерации при получении письменного заявления от юридического лица о приеме в члены ФПСР?,"['34. Президент Федерации информирует Председателя регионального \nотделения/Руководителя аккредитованного РСОО по месту нахождения юридического \nлица о поступлении документов на вступление юридического лица в члены Федерации. \nПредседатель регионального отделения /Руководитель аккредитованного РСОО по \nместу нахождения юридического лица имеет право  направить рекомендацию (скан) о \nпринятии (непринятии) юридического лица в члены Федерации  в течение 10 (десяти) \nрабочих дней с момента информирования Президентом Федерации. \nОтрицательная рекомендация должна быть мотивированной.  \nРекомендация Председателя регионального отделения/Руководителя аккредитованного \nРСОО не носит обязательного характера для Президента Федерации. \n35. Президент Федерации не позднее конца месяца, следующего за месяцем приема \nдокументов от юридического лица , принимает решение о принятии (непринятии) в \nчлены Федерации юридического лица. \n36. В случае отказа в принятии в члены Федерации уплаченные кандидатом взносы \nподлежат возврату. \n37.', '25. Председатель регионального отделения /Руководитель аккредитованного РСОО  в \nтечение 5 (пяти) рабочих дней, включая дату получения документов кандидата в члены \nФедерации от инструктора ФПСР, после проверки всех документов должен направить в \nэлектронном виде Президенту Федерации  рекомендацию (скан) о принятии  \n(непринятии) кандидата в члены Федерации. \nОтрицательная рекомендация должна быть мотивированной на основании п.  8 \nПоложения. \nРекомендация Председателя регионального отделения/Руководителя аккредитованного \nРСОО не носит обязательного характера для Президента Федерации. \n26. Президент Федерации  не позднее конца месяца, следующего за месяцем получения \nэлектронного заявления  (анкеты) от кандидата в члены Федерации , проверяет \nдокументы и принимает решение о принятии  (непринятии) в члены Федерации \nфизического лица путем подтверждения (отклонения) электронного заявления (анкеты) \nкандидата в члены Федерации из сво его личного кабинета на сайте Федерации в се ти \nИнтернет ( https://ipsc.ru/).', '31. Юридические лица, желающие вступить в члены Федерации, подают письменное \nзаявление на имя Президента Федерации о приеме в члены ФПСР , в котором должно \nбыть указано: полное наименование юридического лица, адрес юридического лица , \nкоды ОКВЭД, согласие с Уставом Федерации и обязательство соблюдать данный Устав \nи другие нормативные акты Федерации. \n32.', '32. Вместе с письменным заявлением юридические  лица предоставляют следующие \nдокументы: \n\uf02d Протокол о решении вступить в Федерацию уполномоченного органа юридического \nлица, к компетенции которого уставом этого юридического лица отнесено принятие \nданного решения; \n\uf02d Нотариально заверенная копия действующего устава юридического лица и \nизменений к нему; \n\uf02d Нотариально заверенная копия с видетельства о государственной регистрации  \nюридического лица; \n\uf02d Нотариально заверенная копия с видетельства о постановке на учет в налоговом \nоргане юридического лица; \n\uf02d Нотариально завер енная копия выписки из единого государственного реестра \nюридический лиц; \n\uf02d Платежное поручение об оплате вступительного и членского взносов  (членский \nвзнос необходимо оплатить на срок не менее чем за один год  по реквизитам, \nуказанным на сайте Федерации в разделе «Реквизиты» , и в размере, указанном в \nГлаве 7 настоящего Положения). \n33. Вышеуказанные документы юридическое лицо направляет непосредственно в  \nФедерацию на имя Президента Федерации. \n34.', '37. На основании решения Президента Федерации о принятии в члены Федерации \nвыдается: \n\n[Page 8]\n8 \n \n\uf02d физическому лицу – электронное удостоверение установленного образца \n(приложение № 1 к настоящему Положению), которому присваивается персональный \nидентификационный номер . Возможно  также изготовление пластикового \nудостоверения за дополнительную плату  (приложение №  2 к настоящему \nПоложению); \n\uf02d юридическому лицу – решение Президента Федерации, заверенное печатью \nФедерации и подписью Президента Федерации, с присвоением персонального \nидентификационного членского номера. \n38. Персональный идентификационный номер электронного удостоверения указывается в \nличном кабинете члена Федерации  - физического лица . В случае неоплаты членских \nвзносов в личный кабинет члена Федерации н аправляется уведомление с указанием \nсрока оплаты задолженности. В период существования задолженности в озможность \nвнесения изменений в профиль личного кабинета и совершение иных действий с \nаккаунтом заблокирована. \n39.']","Президент Федерации, получив письменное заявление юридического лица о приеме в члены ФПСР, действует следующим образом:

1. Информирует Председателя регионального отделения/Руководителя аккредитованного РСОО по месту нахождения юридического лица о поступлении документов на вступление в члены Федерации.  
2. Председатель регионального отделения/Руководитель аккредитованного РСОО может направить рекомендацию (скан) о принятии (непринятии) в течение 10 рабочих дней с момента информирования; отрицательная рекомендация должна быть мотивированной, но она не является обязательной для Президента.  
3. Президент Федерации не позднее конца месяца, следующего за месяцем приема документов от юридического лица, принимает решение о принятии (непринятии) в члены Федерации.  

Если решение отрицательное, уплаченные взносы подлежат возврату.","При получении письменного заявления от юридического лица, в котором указаны наименование, адрес, коды ОКВЭД, согласие с Уставом и обязательство соблюдать нормативные акты Федерации, Президент Федерации информирует Председателя регионального отделения или Руководителя аккредитованного РСОО по месту нахождения данного юридического лица о поступлении документов. После этого, не позднее конца месяца, следующего за месяцем приема документов, Президент Федерации принимает решение о принятии или непринятии юридического лица в члены Федерации, при этом рекомендация регионального отделения или РСОО не носит для него обязательного характера.",,,,,multi_hop_specific_query_synthesizer
